,title,text
32,Po' Boy Blues,"When I was home de
Sunshine seemed like gold.
When I was home de
Sunshine seemed like gold.
Since I come up North de
Whole damn world's turned cold.

I was a good boy,
Never done no wrong.
Yes, I was a good boy,
Never done no wrong,
But this world is weary
An' de road is hard an' long.

I fell in love with
A gal I thought was kind.
Fell in love with
A gal I thought was kind.
She made me lose ma money
An' almost lose ma mind.

Weary, weary,
Weary early in de morn.
Weary, weary,
Early, early in de morn.
I's so weary
I wish I'd never been born."
33,Problems,"2 and 2 are 4.
4 and 4 are 8.

But what would happen
If the last 4 was late?

And how would it be
If one 2 was me?

Or if the first 4 was you
Divided by 2?"
34,Quiet Girl,"I would liken you
To a night without stars
Were it not for your eyes.
I would liken you
To a sleep without dreams
Were it not for your songs."
35,Sea Calm,"How still,
How strangely still
The water is today,
It is not good
For water
To be so still that way."
36,Still Here,"been scared and battered.
My hopes the wind done scattered.
  Snow has friz me,
  Sun has baked me,

Looks like between 'em they done
  Tried to make me

Stop laughin', stop lovin', stop livin'--
  But I don't care!
  I'm still here!"
37,The Blues,"When the shoe strings break
On both your shoes
And you're in a hurry-
That's the blues.

When you go to buy a candy bar
And you've lost the dime you had-
Slipped through a hole in your pocket somewhere-
That's the blues, too, and bad!"
38,The Dream Keeper,"Bring me all of your dreams,
You dreamer,
Bring me all your
Heart melodies
That I may wrap them
In a blue cloud-cloth
Away from the too-rough fingers
Of the world."
39,The Negro Mother,"Children, I come back today
To tell you a story of the long dark way
That I had to climb, that I had to know
In order that the race might live and grow.
Look at my face -- dark as the night --  
Yet shining like the sun with love's true light.
I am the dark girl who crossed the red sea
Carrying in my body the seed of the free.
I am the woman who worked in the field
Bringing the cotton and the corn to yield.
I am the one who labored as a slave,
Beaten and mistreated for the work that I gave --  
Children sold away from me, husband sold, too.
No safety , no love, no respect was I due.

Three hundred years in the deepest South:
But God put a song and a prayer in my mouth .
God put a dream like steel in my soul.
Now, through my children, I'm reaching the goal.

Now, through my children, young and free,
I realized the blessing deed to me.
I couldn't read then. I couldn't write.
I had nothing, back there in the night.
Sometimes, the valley was filled with tears,
But I kept trudging on through the lonely years.
Sometimes, the road was hot with the sun,
But I had to keep on till my work was done:
I had to keep on! No stopping for me --  
I was the seed of the coming Free.
I nourished the dream that nothing could smother
Deep in my breast -- the Negro mother.
I had only hope then , but now through you,
Dark ones of today, my dreams must come true:
All you dark children in the world out there,
Remember my sweat, my pain, my despair.
Remember my years, heavy with sorrow --  
And make of those years a torch for tomorrow.
Make of my pass a road to the light
Out of the darkness, the ignorance, the night.
Lift high my banner out of the dust.
Stand like free men supporting my trust.
Believe in the right, let none push you back.
Remember the whip and the slaver's track.
Remember how the strong in struggle and strife
Still bar you the way, and deny you life --  
But march ever forward, breaking down bars.
Look ever upward at the sun and the stars.
Oh, my dark children, may my dreams and my prayers
Impel you forever up the great stairs --  
For I will be with you till no white brother
Dares keep down the children of the Negro Mother."
40,The Negro Speaks Of Rivers,"I've known rivers:
I've known rivers ancient as the world and older than the
    flow of human blood in human veins.

My soul has grown deep like the rivers.

I bathed in the Euphrates when dawns were young.
I built my hut near the Congo and it lulled me to sleep.
I looked upon the Nile and raised the pyramids above it.
I heard the singing of the Mississippi when Abe Lincoln
    went down to New Orleans, and I've seen its muddy
    bosom turn all golden in the sunset.

I've known rivers:
Ancient, dusky rivers.

My soul has grown deep like the rivers."
41,The Weary Blues,"Droning a drowsy syncopated tune,
    Rocking back and forth to a mellow croon,
           I heard a Negro play.
    Down on Lenox Avenue the other night
    By the pale dull pallor of an old gas light
           He did a lazy sway ....
           He did a lazy sway ....
    To the tune o' those Weary Blues.
    With his ebony hands on each ivory key
  He made that poor piano moan with melody.
         O Blues!
  Swaying to and fro on his rickety stool
  He played that sad raggy tune like a musical fool.
          Sweet Blues!
  Coming from a black man's soul.
         O Blues!
  In a deep song voice with a melancholy tone
  I heard that Negro sing, that old piano moan--
     ""Ain't got nobody in all this world,
         Ain't got nobody but ma self.
         I's gwine to quit ma frownin'
         And put ma troubles on the shelf.""

  Thump, thump, thump, went his foot on the floor.
  He played a few chords then he sang some more--
      ""I got the Weary Blues
         And I can't be satisfied.
         Got the Weary Blues
         And can't be satisfied--
         I ain't happy no mo'
         And I wish that I had died.""
  And far into the night he crooned that tune.
  The stars went out and so did the moon.
  The singer stopped playing and went to bed
  While the Weary Blues echoed through his head.
  He slept like a rock or a man that's dead."
42,Theme for English B,"The instructor said,

   Go home and write
   a page tonight.
   And let that page come out of you--
   Then, it will be true.

I wonder if it's that simple?
I am twenty-two, colored, born in Winston-Salem.
I went to school there, then Durham, then here
to this college on the hill above Harlem.
I am the only colored student in my class.
The steps from the hill lead down into Harlem,
through a park, then I cross St. Nicholas,
Eighth Avenue, Seventh, and I come to the Y,
the Harlem Branch Y, where I take the elevator
up to my room, sit down, and write this page:

It's not easy to know what is true for you or me
at twenty-two, my age. But I guess I'm what
I feel and see and hear, Harlem, I hear you:
hear you, hear me--we two--you, me, talk on this page.
(I hear New York, too.) Me--who?
Well, I like to eat, sleep, drink, and be in love.
I like to work, read, learn, and understand life.
I like a pipe for a Christmas present,
or records--Bessie, bop, or Bach.
I guess being colored doesn't make me not like
the same things other folks like who are other races.
So will my page be colored that I write?

Being me, it will not be white.
But it will be
a part of you, instructor.
You are white--
yet a part of me, as I am a part of you.
That's American.
Sometimes perhaps you don't want to be a part of me.
Nor do I often want to be a part of you.
But we are, that's true!
As I learn from you,
I guess you learn from me--
although you're older--and white--
and somewhat more free.

This is my page for English B."
43,Wake,"Tell all my mourners
To mourn in red --
Cause there ain't no sense
In my bein' dead."
44,Walkers with the Dawn,"Being walkers with the dawn and morning,
Walkers with the sun and morning,
We are not afraid of night,
Nor days of gloom,
Nor darkness--
Being walkers with the sun and morning."
