,title,text
0,Advertisement For The Waldorf-Astoria,"Fine living . . . a la carte?
    Come to the Waldorf-Astoria!

    LISTEN HUNGRY ONES!
Look! See what Vanity Fair says about the
    new Waldorf-Astoria:

    ""All the luxuries of private home. . . .""
Now, won't that be charming when the last flop-house
    has turned you down this winter?
    Furthermore:
""It is far beyond anything hitherto attempted in the hotel
    world. . . ."" It cost twenty-eight million dollars. The fa-
    mous Oscar Tschirky is in charge of banqueting.
    Alexandre Gastaud is chef. It will be a distinguished
    background for society.
So when you've no place else to go, homeless and hungry
    ones, choose the Waldorf as a background for your rags--
(Or do you still consider the subway after midnight good
    enough?)

       ROOMERS
Take a room at the new Waldorf, you down-and-outers--
    sleepers in charity's flop-houses where God pulls a
    long face, and you have to pray to get a bed.
They serve swell board at the Waldorf-Astoria. Look at the menu, will
you:

    GUMBO CREOLE
    CRABMEAT IN CASSOLETTE
    BOILED BRISKET OF BEEF
    SMALL ONIONS IN CREAM
    WATERCRESS SALAD
    PEACH MELBA

Have luncheon there this afternoon, all you jobless.
    Why not?
Dine with some of the men and women who got rich off of
    your labor, who clip coupons with clean white fingers
    because your hands dug coal, drilled stone, sewed gar-
    ments, poured steel to let other people draw dividends
    and live easy.
(Or haven't you had enough yet of the soup-lines and the bit-
    ter bread of charity?)
Walk through Peacock Alley tonight before dinner, and get
    warm, anyway. You've got nothing else to do."
1,April Rain Song,"Let the rain kiss you
Let the rain beat upon your head with silver liquid drops
Let the rain sing you a lullaby
The rain makes still pools on the sidewalk
The rain makes running pools in the gutter
The rain plays a little sleep song on our roof at night
And I love the rain."
2,As I Grew Older,"It was a long time ago.
I have almost forgotten my dream.
But it was there then,
In front of me,
Bright like a sun--
My dream.
And then the wall rose,
Rose slowly,
Slowly,
Between me and my dream.
Rose until it touched the sky--
The wall.
Shadow.
I am black.
I lie down in the shadow.
No longer the light of my dream before me,
Above me.
Only the thick wall.
Only the shadow.
My hands!
My dark hands!
Break through the wall!
Find my dream!
Help me to shatter this darkness,
To smash this night,
To break this shadow
Into a thousand lights of sun,
Into a thousand whirling dreams
Of sun!"
3,Bad Morning,"Here I sit
With my shoes mismated.
Lawdy-mercy!
I's frustrated!"
4,Children's Rhymes,"By what sends
the white kids
I ain't sent:
I know I can't
be President.
What don't bug
them white kids
sure bugs me:
We know everybody
ain't free.

Lies written down
for white folks
ain't for us a-tall:
Liberty And Justice--
Huh!--For All?"
5,Cross,"My old man's a white old man
And my old mother's black.
If ever I cursed my white old man
I take my curses back.
If ever I cursed my black old mother
And wished she were in hell,
I'm sorry for that evil wish
And now I wish her well
My old man died in a fine big house.
My ma died in a shack.
I wonder were I'm going to die,
Being neither white nor black?"
6,Cultural Exchange,"In the Quarter of the Negroes
Where the doors are doors of paper
Dust of dingy atoms
Blows a scratchy sound.
Amorphous jack-o'-Lanterns caper
And the wind won't wait for midnight
For fun to blow doors down.
By the river and the railroad
With fluid far-off going
Boundaries bind unbinding
A whirl of whistles blowing.
No trains or steamboats going--
Yet Leontyne's unpacking.

In the Quarter of the Negroes
Where the doorknob lets in Lieder
More than German ever bore,
Her yesterday past grandpa--
Not of her own doing--
In a pot of collard greens
Is gently stewing.

Pushcarts fold and unfold
In a supermarket sea.
And we better find out, mama,
Where is the colored laundromat
Since we move dup to Mount Vernon.

In the pot behind the paper doors
on the old iron stove what's cooking?
What's smelling, Leontyne?
Lieder, lovely Lieder
And a leaf of collard green.
Lovely Lieder, Leontyne.

You know, right at Christmas
They asked me if my blackness,
Would it rub off?
I said, Ask your mama.

Dreams and nightmares!
Nightmares, dreams, oh!
Dreaming that the Negroes
Of the South have taken over--
Voted all the Dixiecrats
Right out of power--

Comes the COLORED HOUR:
Martin Luther King is Governor of Georgia,
Dr. Rufus Clement his Chief Adviser,
A. Philip Randolph the High Grand Worthy.
In white pillared mansions
Sitting on their wide verandas,
Wealthy Negroes have white servants,
White sharecroppers work the black plantations,
And colored children have white mammies:
Mammy Faubus
Mammy Eastland
Mammy Wallace
Dear, dear darling old white mammies--
Sometimes even buried with our family.
Dear old
Mammy Faubus!

Culture, they say, is a two-way street:
Hand me my mint julep, mammy.
Hurry up!
Make haste!"
7,Daybreak in Alabama,"When I get to be a composer
I'm gonna write me some music about
Daybreak in Alabama
And I'm gonna put the purtiest songs in it
Rising out of the ground like a swamp mist
And falling out of heaven like soft dew.
I'm gonna put some tall tall trees in it
And the scent of pine needles
And the smell of red clay after rain
And long red necks
And poppy colored faces
And big brown arms
And the field daisy eyes
Of black and white black white black people
And I'm gonna put white hands
And black hands and brown and yellow hands
And red clay earth hands in it
Touching everybody with kind fingers
And touching each other natural as dew
In that dawn of music when I
Get to be a composer
And write about daybreak
In Alabama."
8,Democracy,"Democracy will not come
Today, this year
  Nor ever
Through compromise and fear.

I have as much right
As the other fellow has
 To stand
On my two feet
And own the land.

I tire so of hearing people say,
Let things take their course.
Tomorrow is another day.
I do not need my freedom when I'm dead.
I cannot live on tomorrow's bread.

     Freedom
     Is a strong seed
     Planted
     In a great need.

     I live here, too.
     I want freedom
     Just as you."
9,Dinner Guest: Me,"I know I am
The Negro Problem
Being wined and dined,
Answering the usual questions
That come to white mind
Which seeks demurely
To Probe in polite way
The why and wherewithal
Of darkness U.S.A.--
Wondering how things got this way
In current democratic night,
Murmuring gently
Over fraises du bois,
""I'm so ashamed of being white.""

The lobster is delicious,
The wine divine,
And center of attention
At the damask table, mine.
To be a Problem on
Park Avenue at eight
Is not so bad.
Solutions to the Problem,
Of course, wait."
10,Dream Deferred,"What happens to a dream deferred?
Does it dry up
Like a raisin in the sun?
Or fester like a sore--
And then run?
Does it stink like rotten meat?
Or crust and sugar over--
like a syrupy sweet?
Maybe it just sags
like a heavy load.
Or does it explode?"
11,Dream Variations,"To fling my arms wide
In some place of the sun,
To whirl and to dance
Till the white day is done.
Then rest at cool evening
Beneath a tall tree
While night comes on gently,
   Dark like me-
That is my dream!

To fling my arms wide
In the face of the sun,
Dance! Whirl! Whirl!
Till the quick day is done.
Rest at pale evening...
A tall, slim tree...
Night coming tenderly
   Black like me."
12,Dreams,"Hold fast to dreams
For if dreams die
Life is a broken-winged bird
That cannot fly.
Hold fast to dreams
For when dreams go
Life is a barren field
Frozen with snow."
13,Ennui,"It's such a
Bore
Being always
Poor."
14,Freedom's Plow,"When a man starts out with nothing,
When a man starts out with his hands
Empty, but clean,
When a man starts to build a world,
He starts first with himself
And the faith that is in his heart-
The strength there,
The will there to build.

First in the heart is the dream-
Then the mind starts seeking a way.
His eyes look out on the world,
On the great wooded world,
On the rich soil of the world,
On the rivers of the world.

The eyes see there materials for building,
See the difficulties, too, and the obstacles.
The mind seeks a way to overcome these obstacles.
The hand seeks tools to cut the wood,
To till the soil, and harness the power of the waters.
Then the hand seeks other hands to help,
A community of hands to help-
Thus the dream becomes not one man’s dream alone,
But a community dream.
Not my dream alone, but our dream.
Not my world alone,
But your world and my world,
Belonging to all the hands who build.

A long time ago, but not too long ago,
Ships came from across the sea
Bringing the Pilgrims and prayer-makers,
Adventurers and booty seekers,
Free men and indentured servants,
Slave men and slave masters, all new-
To a new world, America!

With billowing sails the galleons came
Bringing men and dreams, women and dreams.
In little bands together,
Heart reaching out to heart,
Hand reaching out to hand,
They began to build our land.
Some were free hands
Seeking a greater freedom,
Some were indentured hands
Hoping to find their freedom,
Some were slave hands
Guarding in their hearts the seed of freedom,
But the word was there always:
  Freedom.

Down into the earth went the plow
In the free hands and the slave hands,
In indentured hands and adventurous hands,
Turning the rich soil went the plow in many hands
That planted and harvested the food that fed
And the cotton that clothed America.
Clang against the trees went the ax into many hands
That hewed and shaped the rooftops of America.
Splash into the rivers and the seas went the boat-hulls
That moved and transported America.
Crack went the whips that drove the horses
Across the plains of America.
Free hands and slave hands,
Indentured hands, adventurous hands,
White hands and black hands
Held the plow handles,
Ax handles, hammer handles,
Launched the boats and whipped the horses
That fed and housed and moved America.
Thus together through labor,
All these hands made America.

Labor! Out of labor came villages
And the towns that grew cities.
Labor! Out of labor came the rowboats
And the sailboats and the steamboats,
Came the wagons, and the coaches,
Covered wagons, stage coaches,
Out of labor came the factories,
Came the foundries, came the railroads.
Came the marts and markets, shops and stores,
Came the mighty products moulded, manufactured,
Sold in shops, piled in warehouses,
Shipped the wide world over:
Out of labor-white hands and black hands-
Came the dream, the strength, the will,
And the way to build America.
Now it is Me here, and You there.
Now it’s Manhattan, Chicago,
Seattle, New Orleans,
Boston and El Paso-
Now it’s the U.S.A.

A long time ago, but not too long ago, a man said:
       ALL MEN ARE CREATED EQUAL--
       ENDOWED BY THEIR CREATOR
       WITH CERTAIN UNALIENABLE RIGHTS--
       AMONG THESE LIFE, LIBERTY
       AND THE PURSUIT OF HAPPINESS.
His name was Jefferson. There were slaves then,
But in their hearts the slaves believed him, too,
And silently too for granted
That what he said was also meant for them.
It was a long time ago,
But not so long ago at that, Lincoln said:
       NO MAN IS GOOD ENOUGH
       TO GOVERN ANOTHER MAN
       WITHOUT THAT OTHER’S CONSENT.
There were slaves then, too,
But in their hearts the slaves knew
What he said must be meant for every human being-
Else it had no meaning for anyone.
Then a man said:
       BETTER TO DIE FREE
       THAN TO LIVE SLAVES
He was a colored man who had been a slave
But had run away to freedom.
And the slaves knew
What Frederick Douglass said was true.

With John Brown at Harper’s Ferry, Negroes died.
John Brown was hung.
Before the Civil War, days were dark,
And nobody knew for sure
When freedom would triumph
""Or if it would,"" thought some.
But others new it had to triumph.
In those dark days of slavery,
Guarding in their hearts the seed of freedom,
The slaves made up a song:
  Keep Your Hand On The Plow! Hold On!
That song meant just what it said: Hold On!
Freedom will come!
   Keep Your Hand On The Plow! Hold On!
Out of war it came, bloody and terrible!
But it came!
Some there were, as always,
Who doubted that the war would end right,
That the slaves would be free,
Or that the union would stand,
But now we know how it all came out.
Out of the darkest days for people and a nation,
We know now how it came out.
There was light when the battle clouds rolled away.
There was a great wooded land,
And men united as a nation.

America is a dream.
The poet says it was promises.
The people say it is promises-that will come true.
The people do not always say things out loud,
Nor write them down on paper.
The people often hold
Great thoughts in their deepest hearts
And sometimes only blunderingly express them,
Haltingly and stumblingly say them,
And faultily put them into practice.
The people do not always understand each other.
But there is, somewhere there,
Always the trying to understand,
And the trying to say,
""You are a man. Together we are building our land.""

America!
Land created in common,
Dream nourished in common,
Keep your hand on the plow! Hold on!
If the house is not yet finished,
Don’t be discouraged, builder!
If the fight is not yet won,
Don’t be weary, soldier!
The plan and the pattern is here,
Woven from the beginning
Into the warp and woof of America:
       ALL MEN ARE CREATED EQUAL.
       NO MAN IS GOOD ENOUGH
       TO GOVERN ANOTHER MAN
       WITHOUT HIS CONSENT.
       BETTER DIE FREE,
       THAN TO LIVE SLAVES.
Who said those things? Americans!
Who owns those words? America!
Who is America? You, me!
We are America!
To the enemy who would conquer us from without,
We say, NO!
To the enemy who would divide
And conquer us from within,
We say, NO!
  FREEDOM!
    BROTHERHOOD!
        DEMOCRACY!
To all the enemies of these great words:
We say, NO!

A long time ago,
An enslaved people heading toward freedom
Made up a song:
    Keep Your Hand On The Plow! Hold On!
The plow plowed a new furrow
Across the field of history.
Into that furrow the freedom seed was dropped.
From that seed a tree grew, is growing, will ever grow.
That tree is for everybody,
For all America, for all the world.
May its branches spread and shelter grow
Until all races and all peoples know its shade.
    KEEP YOUR HAND ON THE PLOW! HOLD ON!"
15,I continue to dream,"I take my dreams and make of them a bronze vase
and a round fountain with a beautiful statue in its center.
And a song with a broken heart and I ask you:
Do you understand my dreams?
Sometimes you say you do,
And sometimes you say you don't.
Either way it doesn't matter.
I continue to dream."
16,"I, Too, Sing America","I, too, sing America.

I am the darker brother.
They send me to eat in the kitchen
When company comes,
But I laugh,
And eat well,
And grow strong.

Tomorrow,
I'll be at the table
When company comes.
Nobody'll dare
Say to me,
""Eat in the kitchen,""
Then.

Besides,
They'll see how beautiful I am
And be ashamed--

I, too, am America."
17,Jazzonia,"Oh, silver tree!
Oh, shining rivers of the soul!

In a Harlem cabaret
Six long-headed jazzers play.
A dancing girl whose eyes are bold
Lifts high a dress of silken gold.

Oh, singing tree!
Oh, shining rivers of the soul!

Were Eve's eyes
In the first garden
Just a bit too bold?
Was Cleopatra gorgeous
In a gown of gold?

Oh, shining tree!
Oh, silver rivers of the soul!

In a whirling cabaret
Six long-headed jazzers play."
18,Juke Box Love Song,"I could take the Harlem night
and wrap around you,
Take the neon lights and make a crown,
Take the Lenox Avenue busses,
Taxis, subways,
And for your love song tone their rumble down.
Take Harlem's heartbeat,
Make a drumbeat,
Put it on a record, let it whirl,
And while we listen to it play,
Dance with you till day--
Dance with you, my sweet brown Harlem girl."
19,Justice,"That Justice is a blind goddess
Is a thing to which we black are wise:
Her bandage hides two festering sores
That once perhaps were eyes."
20,Let America be America Again,"Let America be America again.
Let it be the dream it used to be.
Let it be the pioneer on the plain
Seeking a home where he himself is free.

(America never was America to me.)

Let America be the dream the dreamers dreamed--
Let it be that great strong land of love
Where never kings connive nor tyrants scheme
That any man be crushed by one above.

(It never was America to me.)

O, let my land be a land where Liberty
Is crowned with no false patriotic wreath,
But opportunity is real, and life is free,
Equality is in the air we breathe.

(There's never been equality for me,
Nor freedom in this ""homeland of the free."")

Say, who are you that mumbles in the dark?
And who are you that draws your veil across the stars?

I am the poor white, fooled and pushed apart,
I am the Negro bearing slavery's scars.
I am the red man driven from the land,
I am the immigrant clutching the hope I seek--
And finding only the same old stupid plan
Of dog eat dog, of mighty crush the weak.

I am the young man, full of strength and hope,
Tangled in that ancient endless chain
Of profit, power, gain, of grab the land!
Of grab the gold! Of grab the ways of satisfying need!
Of work the men! Of take the pay!
Of owning everything for one's own greed!

I am the farmer, bondsman to the soil.
I am the worker sold to the machine.
I am the Negro, servant to you all.
I am the people, humble, hungry, mean--
Hungry yet today despite the dream.
Beaten yet today--O, Pioneers!
I am the man who never got ahead,
The poorest worker bartered through the years.

Yet I'm the one who dreamt our basic dream
In the Old World while still a serf of kings,
Who dreamt a dream so strong, so brave, so true,
That even yet its mighty daring sings
In every brick and stone, in every furrow turned
That's made America the land it has become.
O, I'm the man who sailed those early seas
In search of what I meant to be my home--
For I'm the one who left dark Ireland's shore,
And Poland's plain, and England's grassy lea,
And torn from Black Africa's strand I came
To build a ""homeland of the free.""

The free?

Who said the free?  Not me?
Surely not me?  The millions on relief today?
The millions shot down when we strike?
The millions who have nothing for our pay?
For all the dreams we've dreamed
And all the songs we've sung
And all the hopes we've held
And all the flags we've hung,
The millions who have nothing for our pay--
Except the dream that's almost dead today.

O, let America be America again--
The land that never has been yet--
And yet must be--the land where every man is free.
The land that's mine--the poor man's, Indian's, Negro's, ME--
Who made America,
Whose sweat and blood, whose faith and pain,
Whose hand at the foundry, whose plow in the rain,
Must bring back our mighty dream again.

Sure, call me any ugly name you choose--
The steel of freedom does not stain.
From those who live like leeches on the people's lives,
We must take back our land again,
America!

O, yes,
I say it plain,
America never was America to me,
And yet I swear this oath--
America will be!

Out of the rack and ruin of our gangster death,
The rape and rot of graft, and stealth, and lies,
We, the people, must redeem
The land, the mines, the plants, the rivers.
The mountains and the endless plain--
All, all the stretch of these great green states--
And make America again!"
21,Life Is Fine,"I went down to the river,
I set down on the bank.
I tried to think but couldn't,
So I jumped in and sank.

I came up once and hollered!
I came up twice and cried!
If that water hadn't a-been so cold
I might've sunk and died.

    But it was      Cold in that water!      It was cold!

I took the elevator
Sixteen floors above the ground.
I thought about my baby
And thought I would jump down.

I stood there and I hollered!
I stood there and I cried!
If it hadn't a-been so high
I might've jumped and died.

    But it was      High up there!      It was high!

So since I'm still here livin',
I guess I will live on.
I could've died for love--
But for livin' I was born

Though you may hear me holler,
And you may see me cry--
I'll be dogged, sweet baby,
If you gonna see me die.

    Life is fine!      Fine as wine!      Life is fine!"
22,Lincoln Monument: Washington,"Let's go see Old Abe
Sitting in the marble and the moonlight,
Sitting lonely in the marble and the moonlight,
Quiet for ten thousand centuries, old Abe.
Quiet for a million, million years.

Quiet--

And yet a voice forever
Against the
Timeless walls
Of time--
Old Abe."
23,Love Song for Lucinda,"Love
Is a ripe plum
Growing on a purple tree.
Taste it once
And the spell of its enchantment
Will never let you be.

Love
Is a bright star
Glowing in far Southern skies.
Look too hard
And its burning flame
Will always hurt your eyes.

Love
Is a high mountain
Stark in a windy sky.
If you
Would never lose your breath
Do not climb too high."
24,Madam and Her Madam,"I worked for a woman,
She wasn't mean--
But she had a twelve-room
House to clean.

Had to get breakfast,
Dinner, and supper, too--
Then take care of her children
When I got through.

Wash, iron, and scrub,
Walk the dog around--
It was too much,
Nearly broke me down.

I said, Madam,
Can it be
You trying to make a
Pack-horse out of me?

She opened her mouth.
She cried, Oh, no!
You know, Alberta,
I love you so!

I said, Madam,
That may be true--
But I'll be dogged
If I love you!"
25,Madam and the Phone Bill,"You say I O.K.ed
LONG DISTANCE?
O.K.ed it when?
My goodness, Central
That was then!

I'm mad and disgusted
With that Negro now.
I don't pay no REVERSED
CHARGES nohow.

You say, I will pay it--
Else you'll take out my phone?
You better let
My phone alone.

I didn't ask him
To telephone me.
Roscoe knows darn well
LONG DISTANCE
Ain't free.

If I ever catch him,
Lawd, have pity!
Calling me up
From Kansas City.

Just to say he loves me!
I knowed that was so.
Why didn't he tell me some'n
I don't know?

For instance, what can
Them other girls do
That Alberta K. Johnson
Can't do--and more, too?

What's that, Central?
You say you don't care
Nothing about my
Private affair?

Well, even less about your
PHONE BILL, does I care!

Un-humm-m! . . . Yes!
You say I gave my O.K.?
Well, that O.K. you may keep--

But I sure ain't gonna pay!"
26,Merry-Go-Round,"Where is the Jim Crow section
On this merry-go-round,
Mister, cause I want to ride?
Down South where I come from
White and colored
Can't sit side by side.
Down South on the train
There's a Jim Crow car.
On the bus we're put in the back—
But there ain't no back
To a merry-go-round!
Where's the horse
For a kid that's black?"
27,Minstrel Man,"Because my mouth
Is wide with laughter
And my throat
Is deep with song,
You do not think
I suffer after
I have held my pain
So long?

Because my mouth
Is wide with laughter,
You do not hear
My inner cry?
Because my feet
Are gay with dancing,
You do not know
I die?"
28,Mother to Son,"Well, son, I'll tell you:
Life for me ain't been no crystal stair.
It's had tacks in it,
And splinters,
And boards torn up,
And places with no carpet on the floor—
Bare.
But all the time
I'se been a-climbin' on,
And reachin' landin's,
And turnin' corners,
And sometimes goin' in the dark
Where there ain't been no light.
So, boy, don't you turn back.
Don't you set down on the steps.
'Cause you finds it's kinder hard.
Don't you fall now—
For I'se still goin', honey,
I'se still climbin',
And life for me ain't been no crystal stair."
29,My People,"The night is beautiful,
So the faces of my people.

The stars are beautiful,
So the eyes of my people.

Beautiful, also, is the sun.
Beautiful, also, are the souls of my people."
30,Night Funeral in Harlem,"Night funeral
    In Harlem:

    Where did they get
    Them two fine cars?

Insurance man, he did not pay--
His insurance lapsed the other day--
Yet they got a satin box
for his head to lay.

    Night funeral
    In Harlem:

    Who was it sent
    That wreath of flowers?

Them flowers came
from that poor boy's friends--
They'll want flowers, too,
When they meet their ends.

    Night funeral
    in Harlem:

    Who preached that
    Black boy to his grave?

Old preacher man
Preached that boy away--
Charged Five Dollars
His girl friend had to pay.

    Night funeral
    In Harlem:

When it was all over
And the lid shut on his head
and the organ had done played
and the last prayers been said
and six pallbearers
Carried him out for dead
And off down Lenox Avenue
That long black hearse done sped,
    The street light
    At his corner
    Shined just like a tear--
That boy that they was mournin'
Was so dear, so dear
To them folks that brought the flowers,
To that girl who paid the preacher man--
It was all their tears that made
    That poor boy's
    Funeral grand.

    Night funeral
    In Harlem."
31,Oppression,"Now dreams
Are not available
To the dreamers,
Nor songs
To the singers.

In some lands
Dark night
And  cold steel
Prevail
But the dream
Will come back,
And the song
Break
Its jail."
