,title,text
249,The Beginnings,"It was not part of their blood,
    It came to them very late
  With long arrears to make good,
    When the English began to hate.

  They were not easily moved,
     They were icy-willing to wait
  Till every count should be proved,
    Ere the English began to hate.

  Their voices were even and low,
    Their eyes were level and straight.
  There was neither sign nor show,
    When the English began to hate.

  It was not preached to the crowd,
    It was not taught by the State.
  No man spoke it aloud,  
    When the English began to hate.

  It  was not suddenly bred,
    It  will not swiftly abate,
  Through the chill years ahead,
    When Time shall count from the date
    That the English began to hate."
250,The Bell Buoy,"They christened my brother of old--
    And a saintly name he bears--
They gave him his place to hold
 At the head of the belfry-stairs,
 Where the minister-towers stand
And the breeding kestrels cry.
 Would I change with my brother a league inland?
(Shoal! 'Ware shoal!) Not I!

In the flush of the hot June prime,
 O'er sleek flood-tides afire,
I hear him hurry the chime
 To the bidding of checked Desire;
 Till the sweated ringers tire
And the wild bob-majors die.
 Could I wait for my turn in the godly choir?
(Shoal! 'Ware shoal!) Not I!

When the smoking scud is blown--
 When the greasy wind-rack lowers--
Apart and at peace and alone,
 He counts the changeless hours.
 He wars with darkling Powers
(I war with a darkling sea);
 Would he stoop to my work in the gusty mirk?
(Shoal! 'Ware shoal!) Not he!

There was never a priest to pray
 There was never a hand to toll,
When they made me guard of the bay,
 And moored me over the shoal.
I rock, I reel, and I roll--
My four great hammers ply--
Could I speak or be still at the Church's will?
(Shoal! 'Ware shoal!) Not I!

The landward marks have failed,
 The fog-bank glides unguessed,
The seaward lights are veiled,
 The spent deep feigns her rest:
 But my ear is laid to her breast,
I lift to the swell--I cry!
 Could I wait in sloth on the Church's oath?
(Shoal! 'Ware shoal!) Not I!

At the careless end of night
 I thrill to the nearing screw;
I turn in the clearing light
 And I call to the drowsy crew;
 And the mud boils foul and blue
As the blind bow backs away.
 Will they give me their thanks if they clear the banks?
(Shoal! 'Ware shoal!) Not they!

The beach-pools cake and skim,
 The bursting spray-heads freeze,
I gather on crown and rim
 The grey, grained ice of the seas,
 Where, sheathed from bitt to trees,
The plunging colliers lie.
 Would I barter my place for the Church's grace?
(Shoal! 'Ware shoal!) Not I!

Through the blur of the whirling snow,
 Or the black of the inky sleet,  
The lanterns gather and grow,
 And I look for the homeward fleet.
 Rattle of block and sheet--
""Ready about-stand by!""
 Shall I ask them a fee ere they fetch the quay?
(Shoal! 'Ware shoal!) Not I!

I dip and I surge and I swing
 In the rip of the racing tide,
By the gates of doom I sing,
 On the horns of death I ride.
 A ship-length overside,
Between the course and the sand,
 Fretted and bound I bide
       Peril whereof I cry.
Would I change with my brother a league inland?
(Shoal! 'Ware shoal!) Not I!"
251,The Bells and Queen Victoria,"""Gay go up and gay go down
To ring the Bells of London Town.""
When London Town's asleep in bed
You'll hear the Bells ring overhead.
In excelsis gloria!
Ringing for Victoria,
Ringing for their mighty mistress--ten years dead!


    THE BELLS:

    Here is more gain than Gloriana guessed--
      Then Gloriana guessed or Indies bring--
    Then golden Indies bring. A Queen confessed--
      A Queen confessed that crowned her people King.
    Her people King,  and crowned a11 Kings above,
      Above a11 Kings have crowned their Queen their love--
    Have crowned their love their Queen, their Queen their love!
    Denying her, we do ourselves deny,
      Disowning her are we ourselves disowned.
    Mirror was she of our fidelity,
      And handmaid of our destiny enthroned;
    The very marrow of Youth's dream, and still
    Yoke-mate of  wisest Age that worked her will!

    Our fathers had declared to us her praise--
      Her praise the years had proven past all speech.
    And past all speech our loyal hearts always,
      Always our hearts lay open, each to each--
    Therefore men gave the treasure of their blood
    To this one woman--for she understood!

Four o' the clock! Now all the world is still.
Oh, London Bells, to all the world declare
The Secret of the Empire--read who will!
The Glory of the People--touch who dare!


    THE BELLS:

Power that has reached itself all kingly powers,
St. Margaret's: By love o'erpowered--
St. Martin's:  By love o'erpowered--
St. Clement Danes:  By love o'erpowered,
                                   The greater power confers!


    THE BELLS:

For we were hers, as she, as she was ours,
Bow Bells: And she was ours--
St. Paul's:  And  she  was  ours--
Westminister:  And  she  was  ours,
                                      As we, even we, were hers!

THE BELLS

      As we were hers!"
252,The Benefactors,"Ah! What avails the classic bent
And what the cultured word,
Against the undoctored incident
That actually occurred?

And what is Art whereto we press
Through paint and prose and rhyme--
When Nature in her nakedness
Defeats us every time?

It is not learning, grace nor gear,
 Nor easy meat and drink,
But bitter pinch of pain and fear
 That makes creation think.


When in this world's unpleasing youth
 Our godlike race began,
The longest arm, the sharpest tooth,
 Gave man control of man;


Till, bruised and bitten to the bone
 And taught by pain and fear,
He learned to deal the far-off stone,
 And poke the long, safe spear.

So tooth and nail were obsolete
 As means against a foe,
Till, bored by uniform defeat,
 Some genius built the bow.

Then stone and javelin proved as vain
 As old-time tooth and nail;
Till, spurred anew by fear and pain,
 Man fashioned coats of mail.

Then was there safety for the rich
 And danger for the poor,
Till someone mixed a powder which
 Redressed the scale once more.

Helmet and armour disappeared
 With sword and bow and pike,
And, when the smoke of battle cleared,
 All men were armed alike.   .   .   .

And when ten million such were slain
 To please one crazy king,
Man, schooled in bulk by fear and pain,
 Grew weary of the thing;

And, at the very hour designed,
 To enslave him past recall,
His tooth-stone-arrow-gun-shy mind
 Turned and abolished all.

All Power, each Tyrant, every Mob
Whose head has grown too large,
Ends by destroying its own job
And works its own discharge;

And Man, whose mere necessities
Move all things from his path,
Trembles meanwhile at their decrees,
And deprecates their wrath!"
253,The Betrothed,"Open the old cigar-box, get me a Cuba stout,
For things are running crossways, and Maggie and I are out.

We quarrelled about Havanas -- we fought o'er a good cheroot,
And I knew she is exacting, and she says I am a brute.

Open the old cigar-box -- let me consider a space;
In the soft blue veil of the vapour musing on Maggie's face.

Maggie is pretty to look at -- Maggie's a loving lass,
But the prettiest cheeks must wrinkle, the truest of loves must pass.

There's peace in a Larranaga, there's calm in a Henry Clay;
But the best cigar in an hour is finished and thrown away --

Thrown away for another as perfect and ripe and brown --
But I could not throw away Maggie for fear o' the talk o' the town!

Maggie, my wife at fifty -- grey and dour and old --
With never another Maggie to purchase for love or gold!

And the light of Days that have Been the dark of the Days that Are,
And Love's torch stinking and stale, like the butt of a dead cigar --

The butt of a dead cigar you are bound to keep in your pocket --
With never a new one to light tho' it's charred and black to the socket!

Open the old cigar-box -- let me consider a while.
Here is a mild Manila -- there is a wifely smile.

Which is the better portion -- bondage bought with a ring,
Or a harem of dusky beauties, fifty tied in a string?

Counsellors cunning and silent -- comforters true and tried,
And never a one of the fifty to sneer at a rival bride?

Thought in the early morning, solace in time of woes,
Peace in the hush of the twilight, balm ere my eyelids close,

This will the fifty give me, asking nought in return,
With only a Suttee's passion -- to do their duty and burn.

This will the fifty give me. When they are spent and dead,
Five times other fifties shall be my servants instead.

The furrows of far-off Java, the isles of the Spanish Main,
When they hear my harem is empty will send me my brides again.

I will take no heed to their raiment, nor food for their mouths withal,
So long as the gulls are nesting, so long as the showers fall.

I will scent 'em with best vanilla, with tea will I temper their hides,
And the Moor and the Mormon shall envy who read of the tale of my brides.

For Maggie has written a letter to give me my choice between
The wee little whimpering Love and the great god Nick o' Teen.

And I have been servant of Love for barely a twelvemonth clear,
But I have been Priest of Cabanas a matter of seven year;

And the gloom of my bachelor days is flecked with the cheery light
Of stums that I burned to Friendship and Pleasure and Work and Fight.

And I turn my eyes to the future that Maggie and I must prove,
But the only light on the marshes is the Will-o'-the-Wisp of Love.

Will it see me safe through my journey or leave me bogged in the mire?
Since a puff of tobacco can cloud it, shall I follow the fitful fire?

Open the old cigar-box -- let me consider anew --
Old friends, and who is Maggie that I should abandon you?

A million surplus Maggies are willing to bear the yoke;
And a woman is only a woman, but a good Cigar is a Smoke.

Light me another Cuba -- I hold to my first-sworn vows.
If Maggie will have no rival, I'll have no Maggie for Spouse!"
254,The Birthright,"The miracle of our land's speech--so known
And long received, none marvel when 'tis shown!

We have such wealth as Rome at her most pride
Had not or (having) scattered not so wide;
Nor with such arrant prodigality,
Beneath her any pagan's foot let lie...
Lo! Diamond that cost some half their days
To find and t'other half to bring to blaze:
Rubies of every heat, wherethrough we scan
The fiercer and more fiery heart of man:
Emerald that with the uplifted billow vies,
And Sapphires evening remembered skies:
Pearl perfect, as immortal tears must show,
Bred, in deep waters, of a piercing woe;
And tender Turkis, so with charms y-writ,
Of woven gold, Time dares not bite on it.
Thereafter, in all manners worked and set,
Jade, coral, amber, crystal ivories, jet,--
Showing no more than various fancies, yet
Each a Life's token or Love's amulet
Which things, through timeless arrogance of use,
We neither guard nor garner, but abuse;
So that our scholars--nay, our children-fling
In sport or jest treasure to arm a King;
And the gross crowd, at feast or market, hold
Traffic perforce with dust of gems and gold!"
255,The Bother,"Clough


Hastily Adam our driver swallowed a curse in the darkness--
Petrol nigh at end and something wrong with a sprocket
Made him speer for the nearest town, when lo!  at the crossways
Four blank letterless arms the virginal signpost extended.
""Look!"" thundered Hugh the Radical. ""This is the England we
     boast of--
Bland, white-bellied, obese, but utterly useless  for business.
They are repainting the signs and have left the job in the middle.
They are repainting  the  signs and traffic may stop till they've
     done it,
Which is to say: till the son-of-a-gun of a local contractor,
Having laboriously wiped out every name for
Probably thirty miles round, be minded to finish his labour!
Had not the fool the sense to paint out and paint in together?""

Thus, not seeing his speech belied his Radical Gospel
(Which is to paint out the earth and then write ""Damn"" on the
         shutter),
Hugh embroidered the theme imperially and stretched it
From some borough in Wales through our Australian possessions,
Making himself, reformer-wise,  a bit of  a nuisance
Till, with the help of Adam, we cast him out on the landscape."
256,The Braggart,"Petrolio, vaunting his Mercedes' power,
Vows she can cover eighty miles an hour.
I tried the car of old and know she can.
But dare he ever make her? Ask his man!"
257,The Broken Men,"For things we never mention,
 For Art misunderstood --
For excellent intention
 That did not turn to good;
From ancient tales' renewing,
 From clouds we would not clear --
Beyond the Law's pursuing
 We fled, and settled here.

We took no tearful leaving,
 We bade no long good-byes.
Men talked of crime and thieving,
 Men wrote of fraud and lies.
To save our injured feelings
 'Twas time and time to go --
Behind was dock and Dartmoor,
 Ahead lay Callao!

The widow and the orphan
 That pray for ten per cent,
They clapped their trailers on us
 To spy the road we went.
They watched the foreign sailings
 (They scan the shipping still),
And that's your Christian people
 Returning good for ill!

God bless the thoughtful islands
 Where never warrants come;
God bless the just Republics
 That give a man a home,
That ask no foolish questions,
 But set him on his feet;
And save his wife and daughters
 From the workhouse and the street!

On church and square and market
 The noonday silence falls;
You'll hear the drowsy mutter
 Of the fountain in our halls.
Asleep amid the yuccas
 The city takes her ease --
Till twilight brings the land-wind
 To the clicking jalousies.

Day long the diamond weather,
 The high, unaltered blue --
The smell of goats and incense
 And the mule-bells tinkling through.
Day long the warder ocean
 That keeps us from our kin,
And once a month our levee
 When the English mail comes in.

You'll find us up and waiting
 To treat you at the bar;
You'll find us less exclusive
 Than the average English are.
We'll meet you with a carriage,
 Too glad to show you round,
But -- we do not lunch on steamers,
 For they are English ground.

We sail o' nights to England
 And join our smiling Boards --
Our wives go in with Viscounts
 And our daughters dance with Lords,
But behind our princely doings,
 And behind each coup we make,
We feel there's Something Waiting,
 And -- we meet It when we wake.

Ah, God! One sniff of England --
 To greet our flesh and blood --
To hear the traffic slurring
 Once more through London mud!
Our towns of wasted honour --
 Our streets of lost delight!
How stands the old Lord Warden?
 Are Dover's cliffs still white?"
258,The Bronckhurst Divorce Case,"In the daytime, when she moved about me,
In the night, when she was sleeping at my side, --
I was wearied, I was wearied of her presence.
Day by day and night by night I grew to hate her --
Would God that she or I had died!"
259,The Burden,"One grief on me is laid
  Each day of every year,
Wherein no soul can aid,
  Whereof no soul can hear:
Whereto no end is seen
  Except to grieve again--
Ah, Mary Magdalene,
  Where is there greater pain?

To dream on dear disgrace
  Each hour of every day--
To bring no honest face
  To aught I do or say:
To lie from morn till e'en--
  To know my lies are vain--
Ah, Mary Magdalene,
  Where can be greater pain?

To watch my steadfast fear
  Attend mine every way
Each day of every year--
  Each hour of every day:
To burn, and chill between--
  To quake and rage again--
Ah, Mary Magdalene,
  Where shall be greater pain:

One grave to me was given--
To guard till Judgment Day--
But God looked down from Heaven
And rolled the Stone away!
One day of all my years--
One hour of that one day--
His Angel saw my tears
And rolled the Stone away!"
260,The Burial,"When that great Kings return to clay,
  Or Emperors in their pride,
Grief of a day shall fill a day,
 Because its creature died.
But we -- we reckon not with those
 Whom the mere Fates ordain,
This Power that wrought on us and goes
 Back to the Power again.

Dreamer devout, by vision led
 Beyond our guess or reach,
The travail of his spirit bred
 Cities in place of speech.
So huge the all-mastering thought that drove --
 So brief the term allowed --
Nations, not words, he linked to prove
 His faith before the crowd.

It is his will that he look forth
 Across the world he won --
The granite of the ancient North --
 Great spaces washed with sun.

There shall he patient take his seat
 (As when the Death he dared),
And there await a people's feet
 In the paths that he prepared.

There, till the vision he foresaw
 Splendid and whole arise,
And unimagined Empires draw
 To council 'neath his skies,
The immense and brooding Spirit still
 Shall quicken and control.
Living he was the land, and dead,
 His soul shall be her soul!"
261,The Butterfly That Stamped,"There was never a Queen like Balkis,
         From here to the wide world's end;
       But Balkis talked to a butterfly
         As you would talk to a friend.

       There was never a King like Solomon
         Not since the world began;
       But Solomon talked to a butterfly
         As a man would talk to a man.

       She was Queen of Sabea--
         And he was Asia's Lord--
       But they both of 'em talked to butterflies
         When they took their walks abroad!"
262,The Camels Hump,"The Camel's hump is an ugly lump
Which well you may see at the Zoo;
But uglier yet is the hump we get
From having too little to do.

Kiddies and grown-ups too-oo-oo,
If we haven't enough to do-oo-oo,
We get the hump-
Cameelious hump-
The hump that is black and blue!

We climb out of bed with a frouzly head,
And a snarly-yarly voice.
We shiver and scowl and we grunt and we growl
At our bath and our boots and our toys;

And there ought to be a corner for me
(And I know' there is one for you)
When we get the hump-
Cameelious hump-
The hump that is black and blue!

The cure for this ill is not to sit still,
Or frowst with a book by the fire;
But to take a large hoe and a shovel also,
And dig till you gently perspire;

And then you will find that the sun and the wind,
And the Djinn of the Garden too,
Have lifted the hump-
The horrible hump-
The hum that is black and blue!

I get it as well as you-oo-oo-
If I haven't enough to do-oo-oo!
We all get hump-
Cameelious hump-
Kiddies and grown-ups too!"
263,The Captive,"Not with an outcry to Allah nor any complaining
He answered his name at the muster and stood to the chaining.
When  the twin  anklets were nipped  on the leg-bars  that held them,
He brotherly greeted the armourers stooping to weld them.
Ere the sad dust of the marshalled feet of the chain-gang swallowed him,
Observing him nobly at ease, I alighted and followed him,
Thus we had speech by the way, but not touching his sorrow--
Rather his red Yesterday and his regal To-morrow,
Wherein he statelily moved to the clink of his chains unregarded,
Nowise abashed but contented to drink of the potion awarded
Saluting aloofly his Fate, he made haste with his story,
And the words of his mouth were as slaves spreading carpets of glory
Embroidered with names of the Djinns--a miraculous weaving--
But the cool and perspicuous eye overbore unbelieving.
So I submitted myself to the limits of rapture--
Bound by this man we had bound, amid captives his capture--
Till he returned me to earth and the visions departed.
But on him be the Peace and the Blessing; for he was greathearted!"
264,The Cat That Walked by Himself,"Pussy can sit by the fire and sing,
         Pussy can climb a tree,
       Or play with a silly old cork and string
          To 'muse herself, not me.
       But I like Binkie my dog, because
          He knows how to behave;
       So, Binkie's the same as the First Friend was,
          And I am the Man in Cave!

       Pussy will play Man Friday till
         It's time to wet her paw
       And make her walk on the window-sill
         (For the footprint Crusoe saw)  
       Then she fluffles her tail and mews,
         And scratches and won't attend.
       But Binkie will play whatever I choose,
         And he is my true First Friend!

       Pussy will rub my knees with her head
         Pretending she loves me hard;
       But the very minute I go to my bed
         Pussy runs out in the yard,
       And there she stays till the morning-light;
         So I know it is only pretend;
       But Binkie, he snores at my feet all night,
         And he is my Firstest Friend!"
265,The Centaurs,"Up came the young Centaur-colts from the plains they were
      fathered in--
  Curious, awkward, afraid.
Burrs on their hocks and their tails, they were branded and gathered in
 Mobs and run up to the yard to be made.

Starting and shying at straws, with sidlings and plungings,
 Buckings and whirlings and bolts;
Greener than grass, but full-ripe for their bridling and lungings,
 Up to the yards and to Chiron they bustled the colts...

First the light web and the cavesson; then the linked keys
 To jingle and turn on the tongue. Then, with cocked ears,
The hours of watching and envy, while comrades at ease
 Passaged and backed, making naught of these terrible gears.

Next, over-pride and its price at the low-seeming fence
 Too oft and too easily taken -- the world-beheld fall!
And none in the yard except Chiron to doubt the immense,
 Irretrievable shame of it all!...

Last, the trained squadron, full-charge -- the sound of a going
 Through dust and spun clods, and strong kicks, pelted in as
      they went,
And repaid at top-speed; till the order to halt without slowing
 Showed every colt on his haunches--and Chiron content!"
266,The Changelings,"Or ever the battered liners sank
 With their passengers to the dark
I was head of a Walworth Bank,
 And you were a grocer's clerk.

I was a dealer in stocks and shares,
 And you in butters and teas;
And we both abandoned our own affairs
 And took to the dreadful seas.

Wet and worry about our ways--
 Panic, onset and flight--
Had us in charge for a thousand days
 And thousand-year-long night.

We saw more than the nights could hide--
 More than the waves could keep--
And--certain faces over the side
 Which do not go from our sleep.

We were more tired than words can tell
 While the pied craft fled by,
And the swinging mounds of the Western swell
 Hoisted us Heavens-high...

Now there is nothing -- not even our rank--
 To witness what we have been;
And I am returned to my Walworth Bank
 And you to your margarine!"
267,The Children,"These were our children who died for our lands: they were dear in our sight.
We have only the memory left of their hometreasured sayings and laughter.
The price of our loss shall be paid to our hands, not another's hereafter.
Neither the Alien nor Priest shall decide on it. That is our right.
But who shall return us the children ?
At the hour the Barbarian chose to disclose his pretences,
And raged against Man, they engaged, on the breasts that they bared for us,
The first felon-stroke of the sword he had longtime prepared for us -
Their bodies were all our defence while we wrought our defences.

They bought us anew with their blood, forbearing to blame us,
Those hours which we had not made good when the Judgment o'ercame us.
They believed us and perished for it. Our statecraft, our learning
Delivered them bound to the Pit and alive to the burning
Whither they mirthfully hastened as jostling for honour.
Not since her birth has our Earth seen such worth loosed upon her!

Nor was their agony brief, or once only imposed on them.
The wounded, the war-spent, the sick received no exemption:
Being cured they returned and endured and achieved our redemption,
Hopeless themselves of relief, till Death, marvelling, closed on them.

That flesh we had nursed from the first in all cleanness was given
To corruption unveiled and assailed by the malice of Heaven -
By the heart-shaking jests of Decay where it lolled on the wires
To be blanched or gay-painted by fumes - to be cindered by fires -
To be senselessly tossed and retossed in stale mutilation
From crater to crater. For this we shall take expiation.
But who shall return us our children?"
