,title,text
135,If,"If you can keep your head when all about you
 Are losing theirs and blaming it on you;
If you can trust yourself when all men doubt you,
 But make allowance for their doubting too:
If you can wait and not be tired by waiting,
 Or, being lied about, don't deal in lies,
Or being hated don't give way to hating,
 And yet don't look too good, nor talk too wise;

If you can dream---and not make dreams your master;
 If you can think---and not make thoughts your aim,
If you can meet with Triumph and Disaster
 And treat those two impostors just the same:.
If you can bear to hear the truth you've spoken
 Twisted by knaves to make a trap for fools,
Or watch the things you gave your life to, broken,
 And stoop and build'em up with worn-out tools;

If you can make one heap of all your winnings
 And risk it on one turn of pitch-and-toss,
And lose, and start again at your beginnings,
 And never breathe a word about your loss:
If you can force your heart and nerve and sinew
 To serve your turn long after they are gone,
And so hold on when there is nothing in you
 Except the Will which says to them: ""Hold on!""

If you can talk with crowds and keep your virtue,
 Or walk with Kings---nor lose the common touch,
If neither foes nor loving friends can hurt you,
 If all men count with you, but none too much:
If you can fill the unforgiving minute
 With sixty seconds' worth of distance run,
Yours is the Earth and everything that's in it,
 And---which is more---you'll be a Man, my son!"
136,In Error,"They burnt a corpse upon the sand--
The light shone out afar;
It guided home the plunging dhows
That beat from Zanzibar.
Spirit of Fire, where'er Thy altars rise,
Thou art the Light of Guidance to our eyes!"
137,In Springtime,"My garden blazes brightly with the rose-bush and the peach,
 And the koil sings above it, in the siris by the well,
From the creeper-covered trellis comes the squirrel's chattering speech,
 And the blue jay screams and flutters where the cheery sat-bhai dwell.
But the rose has lost its fragrance, and the koil's note is strange;
 I am sick of endless sunshine, sick of blossom-burdened bough.
Give me back the leafless woodlands where the winds of Springtime range --
 Give me back one day in England, for it's Spring in England now!

Through the pines the gusts are booming, o'er the brown fields blowing chill,
 From the furrow of the ploughshare streams the fragrance of the loam,
And the hawk nests on the cliffside and the jackdaw in the hill,
 And my heart is back in England 'mid the sights and sounds of Home.
But the garland of the sacrifice this wealth of rose and peach is,
 Ah! koil, little koil, singing on the siris bough,
In my ears the knell of exile your ceaseless bell like speech is --
 Can you tell me aught of England or of Spring in England now?"
138,In the House of Suddhoo,"A stone's throw out on either hand
From that well-ordered road we tread,
And all the world is wild and strange;
Churel and ghoul and Djinn and sprite
Shall bear us company to-night,
For we have reached the Oldest Land
Wherein the powers of Darkness range."
139,In the Matter of One Compass,"When, foot to wheel and back to wind,
The helmsman dare not look behind,
But hears beyond his compass-light,
The blind bow thunder through the night,
And, like a harpstring ere it snaps,
The rigging sing beneath the caps;
 Above the shriek of storm in sail
   Or rattle of the blocks blown free,
 Set for the peace beyond the gale,
   This song the Needle sings the Sea;

Oh, drunken Wave! Oh, driving Cloud!
 Rage of the Deep and sterile Rain,
By love upheld, by God allowed,
 We go, but we return again!

When leagued about the 'wildered boat
The rainbow Jellies fill and float,
And, lilting where the laver lingers,
The Starfish trips on all her fingers;
Where, 'neath his myriad spines ashock,
The Sea-egg ripples down the rock,
An orange wonder dimly guessed
From darkness where the Cuttles rest,
Moored o'er the darker deeps that hide
The blind white Sea-snake and his bride,
Who, drowsing, nose the long-lost Ships
Let down through darkness to their lips --
Safe-swung above the glassy death,
Hear what the constant Needle saith:

Oh, lisping Reef! Oh, listless Cloud,
 In slumber on a pulseless main!
By Love upheld, by God allowed,
 We go, but we return again!

E'en so through Tropic and through Trade,
 Awed by the shadow of new skies,
As we shall watch old planets fade
 And mark the stranger stars arise,
So, surely, back through Sun and Cloud,
 So, surely, from the outward main
By Love recalled, by God allowed,
 Shall we return -- return again!
 Yea, we return -- return again!"
140,In The Neolithic Age,"In the Neolithic Age savage warfare did I wage
For food and fame and woolly horses' pelt;
I was singer to my clan in that dim, red Dawn of Man,
And I sang of all we fought and feared and felt.

Yea, I sang as now I sing, when the Prehistoric spring
Made the piled Biscayan ice-pack split and shove;
And the troll and gnome and dwerg, and the Gods of Cliff and Berg
Were about me and beneath me and above.

But a rival, of Solutr]/e, told the tribe my style was ~outr]/e~ --
'Neath a tomahawk of diorite he fell.
And I left my views on Art, barbed and tanged, below the heart
Of a mammothistic etcher at Grenelle.

Then I stripped them, scalp from skull, and my hunting dogs fed full,
And their teeth I threaded neatly on a thong;
And I wiped my mouth and said, ""It is well that they are dead,
For I know my work is right and theirs was wrong.""

But my Totem saw the shame; from his ridgepole shrine he came,
And he told me in a vision of the night: --
""There are nine and sixty ways of constructing tribal lays,
And every single one of them is right!""

    .    .    .    .    .

Then the silence closed upon me till They put new clothing on me
Of whiter, weaker flesh and bone more frail;
And I stepped beneath Time's finger, once again a tribal singer
[And a minor poet certified by Tr--ll].

Still they skirmish to and fro, men my messmates on the snow,
When we headed off the aurochs turn for turn;
When the rich Allobrogenses never kept amanuenses,
And our only plots were piled in lakes at Berne.

Still a cultured Christian age sees us scuffle, squeak, and rage,
Still we pinch and slap and jabber, scratch and dirk;
Still we let our business slide -- as we dropped the half-dressed hide --
To show a fellow-savage how to work.

Still the world is wondrous large, -- seven seas from marge to marge, --
And it holds a vast of various kinds of man;
And the wildest dreams of Kew are the facts of Khatmandhu,
And the crimes of Clapham chaste in Martaban.

Here's my wisdom for your use, as I learned it when the moose
And the reindeer roared where Paris roars to-night: --
There are nine and sixty ways of constructing tribal lays,
And -- every -- single -- one -- of -- them -- is -- right!"
141,James I,"The child of Mary Queen of Scots,
 A shifty mother's shiftless son,
Bred up among intrigues and plots,
 Learned in all things, wise in none.
Ungainly, babbling, wasteful, weak,
 Shrewd, clever, cowardly, pedantic,
The sight of steel would blanch his cheek,
 The smell of baccy drive him frantic.
He was the author of his line--
 He wrote that witches should be burnt;
He wrote that monarchs were divine,
 And left a son who--proved they weren't!"
142,Jane's Marriage,"Jane went to Paradise:
 That was only fair.
Good Sir Walter followed her,
 And armed her up the stair.
Henry and Tobias,
 And Miguel of Spain,
Stood with Shakespeare at the top
 To welcome Jane--

Then the Three Archangels
 Offered out of hand
Anything in Heaven's gift
 That she might command.
Azrael's eyes upon her,
 Raphael's wings above,
Michael's sword against her heart,
 Jane said: ""Love.""

Instantly the under-
 Standing Seraphim
Laid their fingers on their lips
 And went to look for him.
Stole across the Zodiac,
    Harnessed Charles's Wain,
 And whispered round the Nebulae
    ""Who loved Jane?""

In a private limbo
 Where none had thought to look,
Sat a Hampshire gentleman
 Reading of a book.
It was called Persuasion
 And it told the plain
Story of the love between
 Him and Jane.

He heard the question,
 Circle Heaven through--
Closed the book and answered:
 ""I did -- and do!""
Quietly but speedily
 (As Captain Wentworth moved)
Entered into Paradise
 The man Jane loved!

Jane lies in Winchester, blessed be her shade!
Praise the Lord for making her, and her for all she made.
And while the stones of Winchester--or Milson Street--remain,
Glory, Love, and Honour unto England's Jane!"
143,Jubal and Tubal Cain,"Jubal sang of the Wrath of God
   And the curse of thistle and thorn--
But Tubal got him a pointed rod,
   And scrabbled the earth for corn.
   Old--old as that early mould,
        Young as the sprouting grain--      
   Yearly green is the strife between
        Jubal and Tubal Cain!

Jubal sang of the new-found sea,
  And the love that its waves divide--
But Tubal hollowed a fallen tree
   And passed to the further side.
   Black-black as the hurricane-wrack,
       Salt as the under-main-
   Bitter and cold is the hate they hold--
   Jubal and Tubal Cain!

Jubal sang of the golden years
   Uhen wars and wounds shall cease--
But Tubal fashioned the hand-flung spears
    And showed his neighbours peace
    New--new as Nine-point-Two
         Older than Lamech's slain--
    Roaring and loud is the feud avowed
         Twix'' Jubal and Tubal Cain!

Jubal sang of the cliffs that bar
   And the peaks that none may crown--
But Tubal clambered by jut and scar
   And there he builded a town.
   High-high as the snowsheds lie,
        Low as the culverts drain--
   Wherever they be they can never agree--
         Jubal and Tubal Cain!"
144,Justice,"Across a world where all men grieve
 And grieving strive the more,
The great days range like tides and leave
 Our dead on every shore.
Heavy the load we undergo,
 And our own hands prepare,
If we have parley with the foe,
 The load our sons must bear.

Before we loose the word
 That bids new worlds to birth,
Needs must we loosen first the sword
 Of Justice upon earth;
Or else all else is vain
 Since life on earth began,
And the spent world sinks back again
 Hopeless of God and Man.

A People and their King
 Through ancient sin grown strong,
Because they feared no reckoning
 Would set no bound to wrong;
But now their hour is past,
 And we who bore it find
Evil Incarnate hell at last
 To answer to mankind.

For agony and spoil
 Of nations beat to dust,
For poisoned air and tortured soil
 And cold, commanded lust,
And every secret woe
 The shuddering waters saw.
Willed and fulfilled by high and low.
 Let them relearn the Low.

That when the dooms are read,
 Not high nor low shall say:--
"" My haughty or my humble head
 Was saved me in this day.""
That, till the end of time,
 Their remnant shall recall
Their fathers old, confederate crime
 Availed them not at all.

That neither schools nor priests,
 Nor Kings may build again
A people with the heart of beasts
 Made wise concerning men.
Whereby our dead shall sleep
 In honour, unbetrayed,
And we in faith and honour keep
 That peace for which they paid."
145,Kim,"Unto whose use the pregnant suns are poised,
With idiot moons and stars retracting stars?
Creep thou between -- thy coming's all unnoised.
Heaven hath her high, as Earth her baser, wars.
Heir to these tumults, this affright, that fray
(By Adam's, fathers', own, sin bound alway);
Peer up, draw out thy horoscope and say
Which planet mends thy threadbare fate, or mars."
146,Kitchener's School,"Oh Hubshee, carry your shoes in your hand and bow your head on your breast!
This is the message of Kitchener who did not break you in jest.
It was permitted to him to fulfil the long-appointed years;
Reaching the end ordained of old over your dead Emirs.

He stamped only before your walls, and the Tomb ye knew was dust:
He gathered up under his armpits all the swords of your trust:
He set a guard on your granaries, securing the weak from the strong:
He said: -- ""Go work the waterwheels that were abolished so long.""

He said: -- ""Go safely, being abased. I have accomplished my vow.""
That was the mercy of Kitchener. Cometh his madness now!
He does not desire as ye desire, nor devise as ye devise:
He is preparing a second host -- an army to make you wise.

Not at the mouth of his clean-lipped guns shall ye learn his name again,
But letter by letter, from Kaf to Kaf, at the mouths of his chosen men.
He has gone back to his own city, not seeking presents or bribes,
But openly asking the English for money to buy you Hakims and scribes.

Knowing that ye are forfeit by battle and have no right to live,
He begs for money to bring you learning -- and all the English give.
It is their treasure -- it is their pleasure -- thus are their hearts inclined:
For Allah created the English mad -- the maddest of all mankind!

They do not consider the Meaning ofThings; they consult not creed nor clan.
Behold, they clap the slave on the back, and behold, he ariseth a man!
They terribly carpet the earth with dead, and before their cannon cool,
They walk unarmed by twos and threes to call the living to school.

How is this reason (which is their reason) to judge a scholar's worth,
By casting a ball at three straight sticks and defending the same with a fourth?
But this they do (which is doubtless a spell) and other matters more strange,
Until, by the operation of years, the hearts of their scholars change:

Till these make come and go great boats or engines upon the rail
(But always the English watch near by to prop them when they fail);
Till these make laws of their own choice and Judges of their
And all the mad English obey the Judges and say that that Law is good.

Certainly they were mad from of old; but I think one new thing,
That the magic whereby they work their magic -- wherefrom their fortunes spring --
May be that they show all peoples their magic and ask no price in return.
Wherefore, since ye are bond to that magic, O Hubshee, make haste and learn!

Certainly also is Kitchener mad. But one sure thing I know --
If he who broke you be minded to teach you, to his Madrissa go!
Go, and carry your shoes in your hand and bow your head on your breast,
For he who did not slay you in sport, he will not teach you in jest."
147,L'envoi,"There's a whisper down the field where the year has shot her yield,
And the ricks stand gray to the sun,
Singing: -- ""Over then, come over, for the bee has quit the clover,
And your English summer's done.""
   You have heard the beat of the off-shore wind,
   And the thresh of the deep-sea rain;
   You have heard the song -- how long! how long?
   Pull out on the trail again!

  Ha' done with the Tents of Shem, dear lass,
  We've seen the seasons through,
  And it's time to turn on the old trail, our own trail, the out trail,
  Pull out, pull out, on the Long Trail -- the trail that is always new.

It's North you may run to the rime-ringed sun,
Or South to the blind Horn's hate;
Or East all the way into Mississippi Bay,
Or West to the Golden Gate;
   Where the blindest bluffs hold good, dear lass,
   And the wildest tales are true,
   And the men bulk big on the old trail, our own trail, the out trail,
   And life runs large on the Long Trail -- the trail that is always new.

The days are sick and cold, and the skies are gray and old,
And the twice-breathed airs blow damp;
And I'd sell my tired soul for the bucking beam-sea roll
Of a black Bilbao tramp;
   With her load-line over her hatch, dear lass,
   And a drunken Dago crew,
   And her nose held down on the old trail, our own trail, the out trail
   From Cadiz Bar on the Long Trail -- the trail that is always new.

There be triple ways to take, of the eagle or the snake,
Or the way of a man with a maid;
But the fairest way to me is a ship's upon the sea
In the heel of the North-East Trade.
   Can you hear the crash on her bows, dear lass,
   And the drum of the racing screw,
   As she ships it green on the old trail, our own trail, the out trail,
   As she lifts and 'scends on the Long Trail --
     the trail that is always new?

See the shaking funnels roar, with the Peter at the fore,
And the fenders grind and heave,
And the derricks clack and grate, as the tackle hooks the crate,
And the fall-rope whines through the sheave;
   It's ""Gang-plank up and in,"" dear lass,
   It's ""Hawsers warp her through!""
   And it's ""All clear aft"" on the old trail, our own trail, the out trail,
   We're backing down on the Long Trail -- the trail that is always new.

O the mutter overside, when the port-fog holds us tied,
And the sirens hoot their dread!
When foot by foot we creep o'er the hueless viewless deep
To the sob of the questing lead!
   It's down by the Lower Hope, dear lass,
   With the Gunfleet Sands in view,
   Till the Mouse swings green on the old trail,
     our own trail, the out trail,
   And the Gull Light lifts on the Long Trail --
     the trail that is always new.

O the blazing tropic night, when the wake's a welt of light
That holds the hot sky tame,
And the steady fore-foot snores through the planet-powdered floors
Where the scared whale flukes in flame!
   Her plates are scarred by the sun, dear lass,
   And her ropes are taut with the dew,
   For we're booming down on the old trail, our own trail, the out trail,
   We're sagging south on the Long Trail -- the trail that is always new.

Then home, get her home, where the drunken rollers comb,
And the shouting seas drive by,
And the engines stamp and ring, and the wet bows reel and swing,
And the Southern Cross rides high!
   Yes, the old lost stars wheel back, dear lass,
   That blaze in the velvet blue.
   They're all old friends on the old trail, our own trail, the out trail,
   They're God's own guides on the Long Trail --
     the trail that is always new.

Fly forward, O my heart, from the Foreland to the Start --
We're steaming all-too slow,
And it's twenty thousand mile to our little lazy isle
Where the trumpet-orchids blow!
   You have heard the call of the off-shore wind,
   And the voice of the deep-sea rain;
   You have heard the song -- how long! how long?
   Pull out on the trail again!

  The Lord knows what we may find, dear lass,
  And The Deuce knows what we may do --
  But we're back once more on the old trail, our own trail, the out trail,
  We're down, hull down on the Long Trail -- the trail that is always new."
148,L'Envoi to Life's Handicap,"My new-cut ashlar takes the light
Where crimson-blank the windows flare;
By my own work, before the night,
Great Overseer I make my prayer.

If there be good in that I wrought,
Thy hand compelled it, Master, Thine;
Where I have failed to meet Thy thought
I know, through Thee, the blame is mine.

One instant's toil to Thee denied
Stands all Eternity's offence,
Of that I did with Thee to guide
To Thee, through Thee, be excellence.

Who, lest all thought of Eden fade,
Bring'st Eden to the craftsman's brain,
Godlike to muse o'er his own trade
And Manlike stand with God again.

The depth and dream of my desire,
The bitter paths wherein I stray,
Thou knowest Who hast made the Fire,
Thou knowest Who hast made the Clay!

One stone the more swings to her place
In that dread Temple of Thy Worth --
It is enough that through Thy grace
I saw naught common on Thy earth.

Take not that vision from my ken;
Oh whatsoe'er may spoil or speed,
Help me to need no aid from men
That I may help such men as need!"
149,La Nuit Blanche,"A much-discerning Public hold
   The Singer generally sings
 And prints and sells his past for gold.

 Whatever I may here disclaim,
   The very clever folk I sing to
   Will most indubitably cling to
 Their pet delusion, just the same.


I had seen, as the dawn was breaking
 And I staggered to my rest,
Tari Devi softly shaking
 From the Cart Road to the crest.
I had seen the spurs of Jakko
 Heave and quiver, swell and sink.
Was it Earthquake or tobacco,
 Day of Doom, or Night of Drink?

In the full, fresh fragrant morning
 I observed a camel crawl,
Laws of gravitation scorning,
 On the ceiling and the wall;
Then I watched a fender walking,
 And I heard grey leeches sing,
And a red-hot monkey talking
 Did not seem the proper thing.

Then a Creature, skinned and crimson,
 Ran about the floor and cried,
And they said that I had the ""jims"" on,
 And they dosed me with bromide,
And they locked me in my bedroom --
 Me and one wee Blood Red Mouse --
Though I said: ""To give my head room
 You had best unroof the house.""

But my words were all unheeded,
 Though I told the grave M.D.
That the treatment really needed
 Was a dip in open sea
That was lapping just below me,
 Smooth as silver, white as snow,
And it took three men to throw me
 When I found I could not go.

Half the night I watched the Heavens
 Fizz like '81 champagne --
Fly to sixes and to sevens,
 Wheel and thunder back again;
And when all was peace and order
 Save one planet nailed askew,
Much I wept because my warder
 Would not let me sit it true.

After frenzied hours of wating,
 When the Earth and Skies were dumb,
Pealed an awful voice dictating
 An interminable sum,
Changing to a tangle story --
 ""What she said you said I said"" --
Till the Moon arose in glory,
 And I found her . . . in my head;

Then a Face came, blind and weeping,
 And It couldn't wipe its eyes,
And It muttered I was keeping
 Back the moonlight from the skies;
So I patted it for pity,
 But it whistled shrill with wrath,
And a huge black Devil City
 Poured its peoples on my path.

So I fled with steps uncertain
 On a thousand-year long race,
But the bellying of the curtain
 Kept me always in one place;
While the tumult rose and maddened
 To the roar of Earth on fire,
Ere it ebbed and sank and saddened
 To a whisper tense as wire.

In tolerable stillness
 Rose one little, little star,
And it chuckled at my illness,
 And it mocked me from afar;
And its breathren came and eyed me,
 Called the Universe to aid,
Till I lay, with naught to hide me,
 'Neath' the Scorn of All Things Made.

Dun and saffron, robed and splendid,
 Broke the solemn, pitying Day,
And I knew my pains were ended,
 And I turned and tried to pray;
But my speech was shattered wholly,
 And I wept as children weep.
Till the dawn-wind, softly, slowly,
 Brought to burning eyelids sleep."
150,Lady Geraldine's Hardship,"I turned -- Heaven knows we women turn too much
To broken reeds, mistaken so for pine
That shame forbids confession -- a handle I turned
(The wrong one, said the agent afterwards)
And so flung clean across your English street
Through the shrill-tinkling glass of the shop-front-paused,
Artemis mazed 'mid gauds to catch a man,
And piteous baby-caps and christening-gowns,
The worse for being worn on the radiator.

My cousin Romney judged me from the bench:
Propounding one sleek forty-shillinged law
That takes no count of the Woman's oversoul.
I should have entered, purred he, by the door --
The man's retort -- the open obvious door --
And since I chose not, he -- not he -- could change
The man's rule, not the Woman's, for the case.
Ten pounds or seven days... Just that... I paid!"
151,Late Came the God,"Late came the God, having sent his forerunners who were
     not regarded--
 Late, but in wrath;
Saying: ""The wrong shall be paid, the contempt be rewarded
 On all that she hath.""
He poisoned the blade and struck home, the full bosom receiving
The wound and the venom in one, past cure or relieving.
He made treaty with Time to stand still that the grief might
    be fresh--
Daily renewed and nightly pursued through her soul to her
    flesh--
Mornings of memory, noontides of agony, midnights unslaked
    for her,
Till the stones of the streets of her Hells and her Paradise ached
    for her.

So she lived while her body corrupted upon her.
 And she called on the Night for a sign, and a Sign was allowed,
And she builded an Altar and served by the light of her Vision--
 Alone, without hope of regard or reward, but uncowed,
Resolute, selfless, divine.
 These things she did in Love's honour...
What is a God beside Woman? Dust and derision!"
152,Letting in the Jungle,"Veil them, cover them, wall them round--
       Blossom, and creeper, and weed--
   Let us forget the sight and the sound,
       The smell and the touch of the breed!
   Fat black ash by the altar-stone,
       Here is the white-foot rain
   And the does bring forth in the fields unsown,
       And none shall affright them again;
   And the blind walls crumble, unknown, o'erthrown,
       And none shall inhabit again!"
