,title,text
373,The Mother's Son,"I have a dream -- a dreadful dream --
 A dream that is never done.
I watch a man go out of his mind,
 And he is My Mother's Son.

They pushed him into a Mental Home,
 And that is like the grave:
For they do not let you sleep upstairs,
 And you aren't allowed to shave.

And it was not disease or crime
 Which got him landed there,
But because They laid on My Mother's Son
 More than a man could bear.

What with noise, and fear of death,
 Waking, and wounds and cold,
They filled the Cup for My Mother's Son
 Fuller than it could hold.

They broke his body and his mind
 And yet They made him live,
And They asked more of My Mother's Son
 Than any man could give.

For, just because he had not died,
 Nor been discharged nor sick,
They dragged it out with My Mother's Son
 Longer than he could stick....

And no one knows when he'll get well --
 So, there he'll have to be:
And, 'spite of the beard in the looking-glass,
  I know that man is me!"
374,The Mother-Lodge,"There was Rundle, Station Master,
An' Beazeley of the Rail,
An' 'Ackman, Commissariat,
An' Donkin' o' the Jail;
An' Blake, Conductor-Sargent,
Our Master twice was 'e,
With 'im that kept the Europe-shop,
Old Framjee Eduljee.

    Outside -- ""Sergeant!  Sir!  Salute!  Salaam!""
    Inside -- ""Brother"", an' it doesn't do no 'arm.
    We met upon the Level an' we parted on the Square,
    An' I was Junior Deacon in my Mother-Lodge out there!

We'd Bola Nath, Accountant,
An' Saul the Aden Jew,
An' Din Mohammed, draughtsman
Of the Survey Office too;
There was Babu Chuckerbutty,
An' Amir Singh the Sikh,
An' Castro from the fittin'-sheds,
The Roman Catholick!

We 'adn't good regalia,
An' our Lodge was old an' bare,
But we knew the Ancient Landmarks,
An' we kep' 'em to a hair;
An' lookin' on it backwards
It often strikes me thus,
There ain't such things as infidels,
Excep', per'aps, it's us.

For monthly, after Labour,
We'd all sit down and smoke
(We dursn't give no banquits,
Lest a Brother's caste were broke),
An' man on man got talkin'
Religion an' the rest,
An' every man comparin'
Of the God 'e knew the best.

So man on man got talkin',
An' not a Brother stirred
Till mornin' waked the parrots
An' that dam' brain-fever-bird;
We'd say 'twas 'ighly curious,
An' we'd all ride 'ome to bed,
With Mo'ammed, God, an' Shiva
Changin' pickets in our 'ead.

Full oft on Guv'ment service
This rovin' foot 'ath pressed,
An' bore fraternal greetin's
To the Lodges east an' west,
Accordin' as commanded
From Kohat to Singapore,
But I wish that I might see them
In my Mother-Lodge once more!

I wish that I might see them,
My Brethren black an' brown,
With the trichies smellin' pleasant
An' the ~hog-darn~ passin' down;                          [Cigar-lighter.]
An' the old khansamah snorin'                                    [Butler.]
On the bottle-khana floor,                                      [Pantry.]
Like a Master in good standing
With my Mother-Lodge once more!

    Outside -- ""Sergeant!  Sir!  Salute!  Salaam!""
    Inside -- ""Brother"", an' it doesn't do no 'arm.
    We met upon the Level an' we parted on the Square,
    An' I was Junior Deacon in my Mother-Lodge out there!"
375,The Native-Born,"We've drunk to the Queen -- God bless her! --
      We've drunk to our mothers' land;
    We've drunk to our English brother
      (But he does not understand);
    We've drunk to the wide creation,
      And the Cross swings low for the morn;
    Last toast, and of obligation,
      A health to the Native-born!

    They change their skies above them,
      But not their hearts that roam!
    We learned from our wistful mothers
      To call old England ""home"";
    We read of the English skylark,
      Of the spring in the English lanes,
    But we screamed with the painted lories
      As we rode on the dusty plains!

    They passed with their old-world legends --
      Their tales of wrong and dearth --
    Our fathers held by purchase,
      But we by the right of birth;
    Our heart's where they rocked our cradle,
      Our love where we spent our toil,
    And our faith and our hope and our honour
      We pledge to our native soil!

    I charge you charge your glasses --
      I charge you drink with me
    To the men of the Four New Nations,
      And the Islands of the Sea --
    To the last least lump of coral
      That none may stand outside,
    And our own good pride shall teach us
      To praise our comrade's pride!

To the hush of the breathless morning
On the thin, tin, crackling roofs,
To the haze of the burned back-ranges
And the dust of the shoeless hoofs --
To the risk of a death by drowning,
To the risk of a death by drouth --
To the men of a million acres,
To the Sons of the Golden South!

    To the Sons of the Golden South (Stand up!),
      And the life we live and know,
    Let a fellow sing o' the little things he cares about,
    If a fellow fights for the little things he cares about
      With the weight of a single blow!

To the smoke of a hundred coasters,
To the sheep on a thousand hills,
To the sun that never blisters,
To the rain that never chills --
To the land of the waiting spring-time,
To our five-meal, meat-fed men,
To the tall, deep-bosomed women,
And the children nine and ten!

    And the children nine and ten (Stand up!),
      And the life we live and know,
    Let a fellow sing o' the little things he cares about,
    If a fellow fights for the little things he cares about
      With the weight of a two-fold blow!

To the far-flung fenceless prairie
Where the quick cloud-shadows trail,
To our neighbour's barn in the offing
And the line of the new-cut rail;
To the plough in her league-long furrow
With the gray Lake gulls behind --
To the weight of a half-year's winter
And the warm wet western wind!

To the home of the floods and thunder,
To her pale dry healing blue --
To the lift of the great Cape combers,
And the smell of the baked Karroo.
To the growl of the sluicing stamp-head --
To the reef and the water-gold,
To the last and the largest Empire,
To the map that is half unrolled!

To our dear dark foster-mothers,
To the heathen songs they sung --
To the heathen speech we babbled
Ere we came to the white man's tongue.
To the cool of our deep verandas --
To the blaze of our jewelled main,
To the night, to the palms in the moonlight,
And the fire-fly in the cane!

To the hearth of our people's people --
To her well-ploughed windy sea,
To the hush of our dread high-altar
Where The Abbey makes us We;
To the grist of the slow-ground ages,
To the gain that is yours and mine --
To the Bank of the Open Credit,
To the Power-house of the Line!

We've drunk to the Queen -- God bless her! --
We've drunk to our mothers' land;
We've drunk to our English brother
(And we hope he'll understand).
We've drunk as much as we're able,
And the Cross swings low for the morn;
Last toast -- and your foot on the table! --
A health to the Native-born!

    A health to the Native-born (Stand up!),
      We're six white men arow,
    All bound to sing o' the little things we care about,
    All bound to fight for the little things we care about
      With the weight of a six-fold blow!
    By the might of our cable-tow (Take hands!),
      From the Orkneys to the Horn,
    All round the world (and a little loop to pull it by),
    All round the world (and a little strap to buckle it),
      A health to the Native-born!"
376,The Naulahka,"There was a strife 'twixt man and maid--
Oh, that was at the birth of time!
But what befell 'twixt man and maid,
Oh, that's beyond the grip of rhyme.
'Twas ""Sweet, I must not bide with you,""
And, ""Love, I cannot bide alone"";
For both were young and both were true.
And both were hard as the nether stone.

Beware the man who's crossed in love;
 For pent-up steam must find its vent.
Stand back when he is on the move,
 And lend him all the Continent.

Your patience, Sirs. The Devil took me up
To the burned mountain over Sicily
(Fit place for me) and thence I saw my Earth--
(Not all Earth's splendour, 'twas beyond my need--)
And that one spot I love--all Earth to me,
And her I love, my Heaven. What said I?
My love was safe from all the powers of Hell-
For you--e'en you--acquit her of my guilt--
But Sula, nestling by our sail--specked sea,
My city, child of mine, my heart, my home--
Mine and my pride--evil might visit there!
It was for Sula and her naked port,
Prey to the galleys of the Algerine,
Our city Sula, that I drove my price--
For love of Sula and for love of her.
The twain were woven--gold on sackcloth--twined
Past any sundering till God shall judge
The evil and the good.
Now it is not good for the Christian's health to hustle the Aryan
    brown,
For the Christian riles, and the Aryan smiles and he weareth the
    Christian down;
And the end of the fight is a tombstone white with the name of
     the  late  deceased,
And the epitaph drear:  ""A Fool lies here who tried to hustle the
      East.""

There is pleasure in the wet, wet clay
When the artist's hand is  potting it.
There is pleasure in the wet, wet lay --
When the poet's pad is blotting it.
There is pleasure in the shine of your picture on the line
At the Royal Acade-my;
But the pleasure felt in these is as chalk to Cheddar cheese
When it comes to a well-made Lie--

To a quite unwreckable Lie,
To a most impeccable Lie!
To  a water-right,  fire-proof,  angle-iron,  sunk-hinge,  time-lock,
        steel-faced Lie!
Not a private handsome Lie,
But a pair-and-brougham Lie,
Not a little-place-at-Tooting, but a country-house-with-shooting
And a ring-fence-deer-park Lie.

              When a lover hies abroad
              Looking for his love,
              Azrael smiling sheathes his sword,
              Heaven smiles above.
              Earth and sea
              His servants be,
              And to lesser compass round,
              That his love be sooner found!

                We meet in an evil land
                That is near to the gates of Hell.
                I wait for thy command
                To serve, to speed or withstand.
                And thou sayest I do not well?

           Oh Love, the flowers so red
            Are only tongues of flame,
           The earth is full of the dead,
           The new-killed, restless dead.
           There is danger beneath and o'erhead,
            And I guard thy gates in fear
            Of words thou canst not hear,
            Of peril and jeopardy,
            Of signs thou canst not see--
.            And thou sayest 'tis ill that I came?

          This I saw when the rites were done,
          And the lamps were dead and the Gods alone,
          And the grey snake coiled on the altar stone--
          Ere I fled from a Fear that I could not see,
          And the Gods of the East made mouths at me.

 Beat off in our last fight were we?
 The greater need to seek the sea.
 For Fortune changeth as the moon
 To caravel and picaroon.
 Then Eastward Ho! or Westward Ho!
 Whichever wind may meetest blow.
  Our quarry sails on either sea,
  Fat prey for such bold lads as we,
  And every sun-dried buccaneer
  Must hand and reef and watch and steer,
  And bear great wrath of sea and sky
  Before the plate-ships wallow by.
  Now, as our tall bows take the foam,
  Let no man turn his heart to home,
  Save to desire plunder more
  And larger warehouse for his store,
  When treasure won from Santos Bay
  Shall make our sea-washed village gay.

     Because I sought it far from men,
     In deserts and alone,
     I found it burning overhead,
     The jewel of a Throne.

      Because I sought--I sought it so
      And spent my days to find--
      It blazed one moment ere it left
      The blacker night behind.

     We be the Gods of the East--
        Older than all--
     Masters of Mourning and Feast--
        How shall we fall?

Will they gape for the husks that ye proffer
 Or yearn to your song
And we--have we nothing to offer
 Who ruled them so long--
In the fume of incense, the clash of the cymbals, the blare of
 the conch and the gong?
Over the strife of the schools
 Low the day burns--
Back with the kine from the pools
 Each one returns
To the life that he knows where the  altar-flame glows and the
 tulsi is trimmed in the urns."
377,The Necessitarian,"I know not in Whose hands are laid
To empty upon earth
From unsuspected ambuscade
The very Urns of Mirth;

Who bids the Heavenly Lark arise
 And cheer our solemn round--
The Jest beheld with streaming eyes
 And grovellings on the ground;

Who joins the flats of Time and Chance
  Behind the prey preferred,
And thrones on Shrieking Circumstance
 The Sacredly Absurd,

Till Laughter, voiceless through excess,
 Waves mute appeal and sore,
Above the midriff's deep distress,
 For breath to laugh once more.

No creed hath dared to hail Him Lord,
 No raptured choirs proclaim,
And Nature's strenuous Overword
 Hath nowhere breathed His Name.

Yet, it must be, on wayside jape,
 The selfsame Power bestows
The selfsame power as went to shape
 His Planet or His Rose."
378,The New Knighthood,"Who gives him the Bath?
""I,"" said the wet,
Rank-Jungle-sweat,
""I'll give him the Bath!""

Who'll sing the psalms?
""We,"" said the Palms.
""Ere the hot wind becalms,
""We'll sing the psalms.""

Who lays on the sword ?
""I,"" said the Sun,
Before he has done,
""I'll lay on the sword.""

""Who fastens his belt?
""I,"" said Short-Rations,
"" I know all the fashions
""Of tightening a belt!""

Who gives him his spur?
""I,"" said his Chief,
Exacting and brief,
""I'll give him the spur.""

Who'll shake his hand?
""I,"" said the Fever,
""And I'm no deceiver,
""I'll shake his hand.""

Who brings him the wine?
""I,"" said Quinine,
""It's a habit of mine.
""I'11 come with his wine.""

Who'll put him to proof?
""I,"" said All Earth.
""Whatever he's worth,
""I'll put to the proof.""

Who'll choose him for Knight?
""I,"" said his Mother,
""Before any other,
""My very own Knight.""

And after this fashion, adventure to seek,
Sir Galahad was made--as it might be last week!"
379,The North Sea Patrol,"Where the East wind is brewed fresh and fresh every morning,
 And the balmy night-breezes blow straight from the Pole,
I heard a Destroyer sing: ""What an enjoya-
 ble life does one lead on the North Sea Patrol!

""To blow things to bits is our business (and Fritz's),
 Which means there are mine-fields wherever you stroll.
Unless you've particular wish to die quick, you'll a-
 void steering close to the North Sea Patrol.

""We warn from disaster the mercantile master
 Who takes in high Dudgeon our life-saving role,
For every one's grousing at Docking and Dowsing
 The marks and the lights on the North Sea Patrol.""

So swept but surviving, half drowned but still driving
 I watched her head out through the swell off the shoal,
And I heard her propellers roar- ""Write to poor fellers
 Who run such a Hell as the North Sea Patrol!"""
380,The Nursing Sister,"Our sister sayeth such and such,
And we must bow to her behests.
Our sister toileth overmuch,
Our little maid that hath no breasts.

A field untilled, a web unwove,
A flower withheld from sun or bee,
An alien in the Courts of Love,
And--teacher unto such as we!

We love her, but we laugh the while,
We laugh, but sobs are mixed with laughter;
Our sister hath no time to smile,
She knows not what must follow after.

Wind of the South, arise and blow,
From beds of spice thy locks shake free;
Breathe on her heart that she may know,
Breathe on her eyes that she may see!

Alas! we vex her with our mirth,
And maze her with most tender scorn,
Who stands beside the Gates of Birth,
Herself a child--a child unborn!

Our sister sayeth such and such,
And we must bow to her behests.
Our sister toileth overmuch,
Our little maid that hath no breasts."
381,The Old Issue,"Here is nothing new nor aught unproven,"" say the Trumpets,
""Many feet have worn it and the road is old indeed.
""It is the King--the King we schooled aforetime! ""
(Trumpets in the marshes-in the eyot at Runnymede!)

""Here is neither haste, nor hate, nor anger,"" peal the Trumpets,
 ""Pardon for his penitence or pity for his fall.
""It is the King!""--inexorable Trumpets--
(Trumpets round the scaffold af the dawning by Whitehall!)


""He hath veiled the Crown And hid the Scepter,"" warn (he Trum pets,
 ""He hath changed the fashion of the lies that cloak his will.
""Hard die the Kings--ah hard--dooms hard!"" declare the Trumpets,
Trumpets at the gang-plank where the brawling troop-decks fill!

Ancient and Unteachable, abide--abide the Trumpets!
 Once again the Trumpets, for the shuddering ground-swell brings  
Clamour over ocean of the harsh, pursuing Trumpets--
 Trumpets of the Vanguard that have sworn no truce with Kings!          

All we have of freedom, all we use or know--
This our fathers bought for us long and long ago.

Ancient Right unnoticed as the breath we draw--
Leave to live by no man's leave, underneath the Law.

Lance and torch and tumult, steel and grey-goose wing
Wrenched it, inch and ell and all, slowly from the king.

Till our fathers 'stablished,, after bloody years,          
How our King is one with us, first among his peers.

So they bought us freedom-not at little cost--        
Wherefore must we watch the King, lest our gain be lost.

Over all things certain, this is sure indeed,
Suffer not the old King: for we know the breed.

Give no ear to bondsmen bidding us endure.
Whining ""He is weak and far""; crying ""Time will cure.""

(Time himself is witness, till the battle joins,
Deeper strikes the rottenness in the people's loins.)

Give no heed to bondsmen masking war with peace.
Suffer not the old King here or overseas.

They that beg us barter--wait his yielding mood--
Pledge  the  years  we  hold  in  trust-pawn  our  brother's blood--

Howso' great their clamour, whatsoe'er their claim,
Suffer not the old King under any name!

Here is naught unproven--here is naught to learn.
It is written what shall  fall if  the King return.

He shall mark our goings, question whence we came,
Set his guards about us, as in Freedom's name.

He shall take a tribute, toll of all our ware;
He shall change our gold for arms--arms we may not bear.

He shall break his Judges if they cross his word;
He shall rule above the Law calling on the Lord.

He shall peep and mutter; and the night shall bring
Watchers 'neath our window, lest we mock the King --

Hate and all division; hosts of hurrying spies;
Money poured in secret, carrion breeding flies.

Strangers of his counsel, hirelings of his pay,
These shall deal our Justice: sell-deny-delay.

We shall drink dishonour, we shall eat abuse
For the Land we look to--for the Tongue we use.

We shall take our station, dirt beneath his feet,
While his hired captains jeer us in the street.

Cruel in the shadow, crafty in the sun,
Far beyond his borders shall his teachings run.

Sloven, sullen, savage, secret, uncontrolled,
Laying on a new land evil of the old--

Long-forgotten bondage, dwarfing heart and brain--
All our fathers died to loose he shall bind again.

Here is nought at venture, random nor untrue
Swings the wheel full-circle, brims the cup anew.

Here is naught unproven, here is nothing hid:
Step for step and word for word--so the old Kings did!

Step by step, and word by word: who is ruled may read.
Suffer not the old Kings:  for we know the breed--

All the right they promise--all the wrong they bring.
Stewards of the Judgment, suffer not this King!"
382,The Oldest Song,"""These were never your true love's eyes.
 Why do you feign that you love them?
You that broke from their constancies,
 And the wide calm brows above them!

This was never your true love's speech.
 Why do you thrill when you hear it?
You that have ridden out of its reach
 The width of the world or near it!

This was never your true love's hair, --
 You that chafed when it bound you
Screened from knowledge or shame or care,
 In the night that it made around you!""

""All these things I know, I know.
 And that's why my heart is breaking!""
""Then what do you gain by pretending so?""
""The joy of an old wound waking."""
383,The Only Son,"She dropped the bar, she shot the bolt, she fed the fire anew
  For she heard  a whimper under the  sill  and  a  great grey paw came through.
  The fresh flame comforted the hut and shone on the roof-beam,
  And the Only Son lay down again and dreamed that he dreamed a dream.
  The last ash fell from the withered log with the click of a falling spark,
  And the Only Son woke up again, and called across the dark:--
  ""Now was I born of womankind and laid in a mother's breast?
  For I have dreamed of a shaggy hide whereon I went to rest.
  And was I born of womankind and laid on a father's arm?
  For I have dreamed of clashing teeth that guarded me from harm.

  And was I born an Only Son and did I play alone?
  For I have dreamed of comrades twain that bit me to the bone.
  And did I break the barley-cake and steep it in the tyre?
  For I have dreamed of a youngling kid new-riven from the byre:
  For I  have  dreamed  of a midnight sky  and  a  midnight call to blood
  And red-mouthed shadows racing by, that thrust me from my food.
  'Tis an hour yet and an hour yet to the rising of the moon,
  But I can see the black roof-tree as plain as it were noon.
  'Tis a league and a league to the Lena Falls where the trooping blackbuck go;
  But I can hear the little fawn that bleats behind the doe.


  'Tis a league and a league to the Lena Falls where the crop and the upland meet,
  But I Can smell the  wet dawn-wind  that wakes  the sprouting wheat.
  Unbar the door. I may not bide, but I must out and see
  If those are wolves that wait outside or my own kin to me!""
        .                 .                    .                .             .
  She loosed the bar,  she slid the bolt, she opened the door anon,
  And a grey bitch-wolf came out of the dark and fawned on the Only Son!"
384,The Other Man,"When the earth was sick and the skies were grey,
And the woods were rotted with rain,
The Dead Man rode through the autumn day
To visit his love again.

His love she neither saw nor heard,
So heavy was her shame;
And tho' the babe within her stirred
She knew not that he came."
385,The Outlaws,"Through learned and laborious years
 They set themselves to find
Fresh terrors and undreamed-of fears
 To heap upon mankind.

ALl that they drew from Heaven above
 Or digged from earth beneath,
They laid into their treasure-trove
 And arsenals of death:

While, for well-weighed advantage sake,
 Ruler and ruled alike
Built up the faith they meant to break
 When the fit hour should strike.

They traded with the careless earth,
 And good return it gave:
They plotted by their neighbour's hearth
 The means to make him slave.

When all was ready to their hand
 They loosed their hidden sword,
And utterly laid waste a land
 Their oath was pledged to guard.

Coldly they went about to raise
 To life and make more dread
Abominations of old days,
 That men believed were dead.

They paid the price to reach their goal
 Across a world in flame;
But their own hate slew their own soul
 Before that victory came."
386,The Overland Mail,"In the name of the Empress of India, make way,
 O Lords of the Jungle, wherever you roam.
The woods are astir at the close of the day --
 We exiles are waiting for letters from Home.
Let the robber retreat -- let the tiger turn tail --
In the Name of the Empress, the Overland Mail!

With a jingle of bells as the dusk gathers in,
 He turns to the foot-path that heads up the hill --
The bags on his back and a cloth round his chin,
 And, tucked in his waist-belt, the Post Office bill:
""Dispatched on this date, as received by the rail,
Per runner, two bags of the Overland Mail.""

Is the torrent in spate? He must ford it or swim.
 Has the rain wrecked the road? He must climb by the cliff.
Does the tempest cry ""Halt""? What are tempests to him?
 The Service admits not a ""but"" or and ""if.""
While the breath's in his mouth, he must bear without fail,
In the Name of the Empress, the Overland Mail.

From aloe to rose-oak, from rose-oak to fir,
 From level to upland, from upland to crest,
From rice-field to rock-ridge, from rock-ridge to spur,
 Fly the soft sandalled feet, strains the brawny brown chest.
From rail to ravine -- to the peak from the vale --
Up, up through the night goes the Overland Mail.

There's a speck on the hillside, a dot on the road --
 A jingle of bells on the foot-path below --
There's a scuffle above in the monkey's abode --
 The world is awake, and the clouds are aglow.
For the great Sun himself must attend to the hail:
""In the name of the Empress the Overland Mail!"""
