,title,text
0,"""Back To The Army Again""","I'm 'ere in a ticky ulster an' a broken billycock 'at,
A-layin' on to the sergeant I don't know a gun from a bat;
My shirt's doin' duty for jacket, my sock's stickin' out o' my boots,
An' I'm learnin' the damned old goose-step along o' the new recruits!

  Back to the Army again, sergeant,
   Back to the Army again.
  Don't look so 'ard, for I 'aven't no card,
   I'm back to the Army again!

I done my six years' service.  'Er Majesty sez:  ""Good-day --
You'll please to come when you're rung for, an' 'ere's your 'ole back-pay;
An' fourpence a day for baccy -- an' bloomin' gen'rous, too;
An' now you can make your fortune -- the same as your orf'cers do.""

  Back to the Army again, sergeant,
   Back to the Army again;
  'Ow did I learn to do right-about turn?
   I'm back to the Army again!

A man o' four-an'-twenty that 'asn't learned of a trade --
Beside ""Reserve"" agin' him -- 'e'd better be never made.
I tried my luck for a quarter, an' that was enough for me,
An' I thought of 'Er Majesty's barricks, an' I thought I'd go an' see.

  Back to the Army again, sergeant,
   Back to the Army again;
  'Tisn't my fault if I dress when I 'alt --
   I'm back to the Army again!

The sergeant arst no questions, but 'e winked the other eye,
'E sez to me, ""'Shun!"" an' I shunted, the same as in days gone by;
For 'e saw the set o' my shoulders, an' I couldn't 'elp 'oldin' straight
When me an' the other rookies come under the barrick-gate.

  Back to the Army again, sergeant,
   Back to the Army again;
  'Oo would ha' thought I could carry an' port?
   I'm back to the Army again!

I took my bath, an' I wallered -- for, Gawd, I needed it so!
I smelt the smell o' the barricks, I 'eard the bugles go.
I 'eard the feet on the gravel -- the feet o' the men what drill --
An' I sez to my flutterin' 'eart-strings, I sez to 'em, ""Peace, be still!""

  Back to the Army again, sergeant,
   Back to the Army again;
  'Oo said I knew when the ~Jumner~ was due?
   I'm back to the Army again!

I carried my slops to the tailor; I sez to 'im, ""None o' your lip!
You tight 'em over the shoulders, an' loose 'em over the 'ip,
For the set o' the tunic's 'orrid.""  An' 'e sez to me, ""Strike me dead,
But I thought you was used to the business!"" an' so 'e done what I said.

  Back to the Army again, sergeant,
   Back to the Army again.
  Rather too free with my fancies?  Wot -- me?
   I'm back to the Army again!

Next week I'll 'ave 'em fitted; I'll buy me a swagger-cane;
They'll let me free o' the barricks to walk on the Hoe again
In the name o' William Parsons, that used to be Edward Clay,
An' -- any pore beggar that wants it can draw my fourpence a day!

  Back to the Army again, sergeant,
   Back to the Army again:
  Out o' the cold an' the rain, sergeant,
   Out o' the cold an' the rain.

                   'Oo's there?
A man that's too good to be lost you,
A man that is 'andled an' made --
A man that will pay what 'e cost you
In learnin' the others their trade -- parade!
You're droppin' the pick o' the Army
Because you don't 'elp 'em remain,
But drives 'em to cheat to get out o' the street
An' back to the Army again!"
1,"""Soldier An' Sailor Too""","As I was spittin' into the Ditch aboard o' the ~Crocodile~,
I seed a man on a man-o'-war got up in the Reg'lars' style.
'E was scrapin' the paint from off of 'er plates,
 an' I sez to 'im, ""'Oo are you?""
Sez 'e, ""I'm a Jolly -- 'Er Majesty's Jolly -- soldier an' sailor too!""
Now 'is work begins by Gawd knows when, and 'is work is never through;
'E isn't one o' the reg'lar Line, nor 'e isn't one of the crew.
'E's a kind of a giddy harumfrodite -- soldier an' sailor too!

An' after I met 'im all over the world, a-doin' all kinds of things,
Like landin' 'isself with a Gatlin' gun to talk to them 'eathen kings;
'E sleeps in an 'ammick instead of a cot,
 an' 'e drills with the deck on a slew,
An' 'e sweats like a Jolly -- 'Er Majesty's Jolly -- soldier an' sailor too!
For there isn't a job on the top o' the earth the beggar don't know, nor do --
You can leave 'im at night on a bald man's 'ead, to paddle 'is own canoe --
'E's a sort of a bloomin' cosmopolouse -- soldier an' sailor too.

We've fought 'em in trooper, we've fought 'em in dock,
 and drunk with 'em in betweens,
When they called us the seasick scull'ry-maids,
 an' we called 'em the Ass Marines;
But, when we was down for a double fatigue, from Woolwich to Bernardmyo,
We sent for the Jollies -- 'Er Majesty's Jollies -- soldier an' sailor too!
They think for 'emselves, an' they steal for 'emselves,
 and they never ask what's to do,
But they're camped an' fed an' they're up an' fed before our bugle's blew.
Ho! they ain't no limpin' procrastitutes -- soldier an' sailor too.

You may say we are fond of an 'arness-cut, or 'ootin' in barrick-yards,
Or startin' a Board School mutiny along o' the Onion Guards;
But once in a while we can finish in style for the ends of the earth to view,
The same as the Jollies -- 'Er Majesty's Jollies -- soldier an' sailor too!
They come of our lot, they was brothers to us;
 they was beggars we'd met an' knew;
Yes, barrin' an inch in the chest an' the arm, they was doubles o' me an' you;
For they weren't no special chrysanthemums -- soldier an' sailor too!

To take your chance in the thick of a rush, with firing all about,
Is nothing so bad when you've cover to 'and, an' leave an' likin' to shout;
But to stand an' be still to the ~Birken'ead~ drill
 is a damn tough bullet to chew,
An' they done it, the Jollies -- 'Er Majesty's Jollies --
 soldier an' sailor too!
Their work was done when it 'adn't begun; they was younger nor me an' you;
Their choice it was plain between drownin' in 'eaps
 an' bein' mopped by the screw,
So they stood an' was still to the ~Birken'ead~ drill, soldier an' sailor too!

We're most of us liars, we're 'arf of us thieves,
 an' the rest are as rank as can be,
But once in a while we can finish in style
 (which I 'ope it won't 'appen to me).
But it makes you think better o' you an' your friends,
 an' the work you may 'ave to do,
When you think o' the sinkin' ~Victorier~'s Jollies -- soldier an' sailor too!
Now there isn't no room for to say ye don't know --
 they 'ave proved it plain and true --
That whether it's Widow, or whether it's ship, Victorier's work is to do,
An' they done it, the Jollies -- 'Er Majesty's Jollies --
 soldier an' sailor too!"
2,A Ballad of Burial,"If down here I chance to die,
 Solemnly I beg you take
All that is left of ""I""
 To the Hills for old sake's sake,
Pack me very thoroughly
 In the ice that used to slake
Pegs I drank when I was dry --
 This observe for old sake's sake.

To the railway station hie,
 There a single ticket take
For Umballa -- goods-train -- I
 Shall not mind delay or shake.
I shall rest contentedly
 Spite of clamor coolies make;
Thus in state and dignity
 Send me up for old sake's sake.

Next the sleepy Babu wake,
 Book a Kalka van ""for four.""
Few, I think, will care to make
 Journeys with me any more
As they used to do of yore.
 I shall need a ""special"" break --
Thing I never took before --
 Get me one for old sake's sake.

After that -- arrangements make.
 No hotel will take me in,
And a bullock's back would break
 'Neath the teak and leaden skin
Tonga ropes are frail and thin,
 Or, did I a back-seat take,
In a tonga I might spin, --
 Do your best for old sake's sake.

After that -- your work is done.
 Recollect a Padre must
Mourn the dear departed one --
 Throw the ashes and the dust.
Don't go down at once. I trust
 You will find excuse to ""snake
Three days' casual on the bust.""
 Get your fun for old sake's sake.

I could never stand the Plains.
 Think of blazing June and May
Think of those September rains
 Yearly till the Judgment Day!
I should never rest in peace,
 I should sweat and lie awake.
Rail me then, on my decease,
 To the Hills for old sake's sake."
3,A Ballade of Jakko Hill,"One moment bid the horses wait,
 Since tiffin is not laid till three,
Below the upward path and straight
 You climbed a year ago with me.
Love came upon us suddenly
 And loosed -- an idle hour to kill --
A headless, armless armory
 That smote us both on Jakko Hill.

Ah Heaven! we would wait and wait
 Through Time and to Eternity!
Ah Heaven! we could conquer Fate
 With more than Godlike constancy
I cut the date upon a tree --
 Here stand the clumsy figures still:
""10-7-85, A.D.""
 Damp with the mist of Jakko Hill.

What came of high resolve and great,
 And until Death fidelity!
Whose horse is waiting at your gate?
 Whose 'rickshaw-wheels ride over me?
No Saint's, I swear; and -- let me see
 To-night what names your programme fill --
We drift asunder merrily,
 As drifts the mist on Jakko Hill.

               L'ENVOI.
Princess, behold our ancient state
 Has clean departed; and we see
'Twas Idleness we took for Fate
 That bound light bonds on you and me.
Amen! Here ends the comedy
 Where it began in all good will;
Since Love and Leave together flee
 As driven mist on Jakko Hill!"
4,A Bank Fraud,"He drank strong waters and his speech was coarse;
He purchased raiment and forbore to pay';
He stuck a trusting junior with a horse,
And won gymkhanas in a doubtful way.
Then 'twixt a vice and folly, turned aside
To do good deeds and straight to cloak them, lied."
5,A Boy Scouts' Patrol Song,"These are our regulations --
 There's just one law for the Scout
And the first and the last, and the present and the past,
 And the future and the perfect is ""Look out!""
 I, thou and he, look out!
 We, ye and they, look out!
 Though you didn't or you wouldn't
 Or you hadn't or you couldn't;
 You jolly well must look out!

Look out, when you start for the day
 That your kit is packed to your mind;
There is no use going away            
 With half of it left behind.
Look out that your laces are tight,
 And your boots are easy and stout,
Or you'll end with a blister at night.
(Chorus) All Patrols look out!

Look out for the birds of the air,
 Look out for the beasts of the field --
They'll tell you how and where
 The other side's concealed.
When the blackbird bolts from the copse,
 Or the cattle are staring about,
The wise commander stops
 And (chorus) All Patrols look out!

Look out when your front is clear,
 And you feel you are bound to win.
Look out for your flank and your rear --
 That's where surprises begin.
For the rustle that isn't a rat,
 For the splash that isn't a trout,
For the boulder that may be a hat
(Chorus) All Patrols look out!

For the innocent knee-high grass,
 For the ditch that never tells,
Look out!  Look out ere you pass --
 And look out for everything else!
A sign mis-read as you run
 May turn retreat to a rout --
For all things under the sun
(Chorus) All Patrols look out!

Look out when your temper goes
 At the end of a losing game;
When your boots are too tight for your toes;
 And you answer and argue and blame.
It's the hardest part of the Low,
 But it has to be learnt by the Scout --
For whining and shirking and ""jaw""
(Chorus) All Patrols look out!"
6,A British-Roman Song,"My father's father saw it not,
And I, belike, shall never come
To look on that so-holy spot --
That very Rome --

Crowned by all Time, all Art, all Might,
The equal work of Gods and Man,
City beneath whose oldest height --
The Race began!

Soon to send forth again a brood,
Unshakable, we pray, that clings
To Rome's thrice-hammered hardihood --
In arduous things.

Strong heart with triple armour bound,
Beat strongly, for thy life-blood runs,
Age after Age, the Empire round --
In us thy Sons

Who, distant from the Seven Hills,
Loving and serving much, require
Thee -- thee to guard 'gainst home-born ills
The Imperial Fire!"
7,A Carol,"Our Lord Who did the Ox command
To kneel to Judah's King,
He binds His frost upon the land
To ripen it for Spring --
To ripen it for Spring, good sirs,
According to His Word.
Which well must be as ye can see --
And who shall judge the Lord?

When we poor fenmen skate the ice
Or shiver on the wold,
We hear the cry of a single tree
That breaks her heart in the cold --
That breaks her heart in the cold, good sirs,
And rendeth by the board.
Which well must be as ye can see --
And who shall judge the Lord?

Her wood is crazed and little worth
Excepting as to burn,
That we may warm and make our mirth
Until the Spring return --
Until the Spring return, good sirs,
When Christians walk abroad;
When well must be as ye can see --
And who shall judge the Lord?

God bless the master of this house,
And all who sleep therein!
And guard the fens from pirate folk,
And keep us all from sin,
To walk in honesty, good sirs,
Of thought and deed ad word!
Which shall befriend our latter end....
And who shall judge the Lord?"
8,A Charm,"Take of English earth as much
As either hand may rightly clutch.
In the taking of it breathe
Prayer for all who lie beneath.
Not the great nor well-bespoke,
But the mere uncounted folk
Of whose life and death is none
Report or lamentation.
Lay that earth upon thy heart,
And thy sickness shall depart!

It shall sweeten and make whole
Fevered breath and festered soul.
It shall mightily restrain
Over-busied hand and brain.
It shall ease thy mortal strife
'Gainst the immortal woe of life,
Till thyself, restored, shall prove
By what grace the Heavens do move.

Take of English flowers these --
Spring's full-vaced primroses,
Summer's wild wide-hearted rose,
Autumn's wall-flower of the close,
And, thy darkness to illume,
Winter's bee-thronged ivy-bloom.
Seek and serve them where they bide
From Candlemas to Christmas-tide,
For these simples, used aright,
Can restore a failing sight.

These shall cleanse and purify
Webbed and inward-turning eye;
These shall show thee treasure hid,
Thy familiar fields amid;
And reveal (which is thy need)
Every man a King indeed!"
9,A Child's Garden,"Now there is nothing wrong with me
Except -- I think it's called T.B.
And that is why I have to lay
Out in the garden all the day.

Our garden is not very wide
And cars go by on either side,
And make an angry-hooty noise
That rather startles little boys.

But worst of all is when they take
Me out in cars that growl and shake,
With charabancs so dreadful-near
I have to shut my eyes for fear.

But when I'm on my back again,
I watch the Croydon aeroplane
That flies across to France, and sings
Like hitting thick piano-strings.

When I am strong enough to do
The things I'm truly wishful to,
I'll never use a car or train
But always have an aeroplane;

And just go zooming round and round,
And frighten Nursey with the sound,
And see the angel-side of clouds,
And spit on all those motor-crowds!"
10,A Code of Morals,"Now Jones had left his new-wed bride to keep his house in order,
And hied away to the Hurrum Hills above the Afghan border,
To sit on a rock with a heliograph; but ere he left he taught
His wife the working of the Code that sets the miles at naught.

And Love had made him very sage, as Nature made her fair;
So Cupid and Apollo linked , per heliograph, the pair.
At dawn, across the Hurrum Hills, he flashed her counsel wise --
At e'en, the dying sunset bore her husband's homilies.

He warned her 'gainst seductive youths in scarlet clad and gold,
As much as 'gainst the blandishments paternal of the old;
But kept his gravest warnings for (hereby the ditty hangs)
That snowy-haired Lothario, Lieutenant-General Bangs.

'Twas General Bangs, with Aide and Staff, who tittupped on the way,
When they beheld a heliograph tempestuously at play.
They thought of Border risings, and of stations sacked and burnt --
So stopped to take the message down -- and this is whay they learnt --

""Dash dot dot, dot, dot dash, dot dash dot"" twice. The General swore.
""Was ever General Officer addressed as 'dear' before?
""'My Love,' i' faith! 'My Duck,' Gadzooks! 'My darling popsy-wop!'
""Spirit of great Lord Wolseley, who is on that mountaintop?""

The artless Aide-de-camp was mute; the gilded Staff were still,
As, dumb with pent-up mirth, they booked that message from the hill;
For clear as summer lightning-flare, the husband's warning ran: --
""Don't dance or ride with General Bangs -- a most immoral man.""

[At dawn, across the Hurrum Hills, he flashed her counsel wise --
But, howsoever Love be blind, the world at large hath eyes.]
With damnatory dot and dash he heliographed his wife
Some interesting details of the General's private life.

The artless Aide-de-camp was mute, the shining Staff were still,
And red and ever redder grew the General's shaven gill.
And this is what he said at last (his feelings matter not): --
""I think we've tapped a private line. Hi! Threes about there! Trot!""

All honour unto Bangs, for ne'er did Jones thereafter know
By word or act official who read off that helio.
But the tale is on the Frontier, and from Michni to Mooltan
They know the worthy General as ""that most immoral man."""
11,A Counting-Out Song,"What is the song the children sing,
When doorway lilacs bloom in Spring,
And the Schools are loosed, and the games are played
That were deadly earnest when Earth was made?
Hear them chattering, shrill and hard,
After dinner-time, out in the yard,
As the sides are chosen and all submit
To the chance of the lot that shall make them ""It.""
(Singing) ""Eenee, Meenee, Mainee, Mo!
Catch a nigger by the toe!
(If he hollers let him go!)
Eenee, Meenee. Mainee, Mo!
You-are-It!""

Eenee, Meenee, Mainee, and Mo
Were the First Big Four of the Long Ago,
When the Pole of the Earth sloped thirty degrees,
And Central Europe began to freeze,
And they needed Ambassadors staunch and stark
To steady the Tribes in the gathering dark:
But the frost was fierce and flesh was frail,
So they launched a Magic that could not fail.
(Singing) ""Eenee, Meenee, Mainee, Mo!
Hear the wolves across the snow!
Some one has to kill 'em--so
Eenee, Meenee, Mainee, Mo
Make--you--It!""

Slowly the Glacial Epoch passed,
Central Europe thawed out at last;
And, under the slush of the melting snows
The first dim shapes of the Nations rose.
Rome, Britannia, Belgium, Gaul--
Flood and avalanche fathered them all;
And the First Big Four, as they watched the mess,
Pitied Man in his helplessness.
(Singing) ""Eenee, Meenee, Mainee, Mo!
Trouble starts When Nations grow,
Some one has to stop it--so
Eenee, Meenee, Mainee, Mo!
Make-you-It!""

Thus it happened, but none can tell
What was the Power behind the spell--
Fear, or Duty, or Pride, or Faith--
That sent men shuddering out to death--
To cold and watching, and, worse than these,
Work, more work, when they looked for ease--
To the days discomfort, the nights despair,
In the hope of a prize that they never could share,
(Singing) ""Eenee, Meenee, Mainee, Mo!
Man is born to Toil and Woe.
One will cure another--so
Eenee, Meenee, Mainee, Mo
Make--you--It!""

Once and again, as the Ice went North
The grass crept up to the Firth of Forth.
Once and again, as the Ice came South
The glaciers ground over Lossiemouth.
But, grass or glacier, cold or hot,
The men went out who would rather not,
And fought with the Tiger, the Pig and the Ape,
To hammer the world into decent shape.
(Singing) ""Eenee, Meenee, Mainee, Mo!
What's the use of doing so?
Ask the Gods, for we don't know;
But Eenee, Meenee, Mainee, Mo
Make-us-It!""

Nothing is left of that terrible rune
But a tag of gibberish tacked to a tune
That ends the waiting and settles the claims
Of children arguing over their games;
For never yet has a boy been found
To shirk his turn when the turn came round;
Nor even a girl has been known to say
""If you laugh at me I shan't play.""
For--  ""Eenee, Meenee, Mainee, Mo,
(Don't you let the grown-ups know!)
You may hate it ever so,
But if you're chose you're bound to go,
When Eenee, Meenee, Mainee, Mo
Make-you-It!"""
12,A Death-Bed,"This is the State above the Law.
 The State exists for the State alone.""
[This is a gland at the back of the jaw,
 And an answering lump by the collar-bone.]

Some die shouting in gas or fire;
  Some die silent, by shell and shot.
Some die desperate, caught on the wire -
 Some die suddenly. This will not.

""Regis suprema voluntas Lex""
[It will follow the regular course of--throats.]
Some die pinned by the broken decks,
 Some die sobbing between the boats.

Some die eloquent, pressed to death
 By the sliding trench as their friends can hear
Some die wholly in half a breath.
 Some--give trouble for half a year.

""There is neither Evil nor Good in life
 Except as the needs of the State ordain.""
[Since it is rather too late for the knife,
All we can do is to mask the pain.]

Some die saintly in faith and hope--
 One died thus in a prison-yard--
Some die broken by rape or the rope;
 Some die easily. This dies hard.

""I will dash to pieces who bar my way.
 Woe to the traitor! Woe to the weak! ""
[Let him write what he wishes to say.
It tires him out if he tries to speak.
Some die quietly. Some abound
 In loud self-pity. Others spread
Bad morale through the cots around  
 This is a type that is better dead.

""The war was forced on me by my foes.
  All that I sought was the right to live.""
[Don't be afraid of a triple dose;
The pain will neutralize all we give.

Here are the needles. See that he dies
While the effects of the drug endure. . . .
What is the question he asks with his eyes?--
Yes, All-Highest, to God, be sure."
13,A Dedication,"And they were stronger hands than mine
That digged the Ruby from the earth--
More cunning brains that made it worth
The large desire of a king,
And stouter hearts that through the brine
Went down the perfect Pearl to bring.

Lo, I have wrought in common clay
Rude figures of a rough-hewn race,
Since pearls strew not the market-place
In this my town of banishment,
Where with the shifting dust I play,
And eat the bread of discontent.

Yet is there life in that I make.
0 thou who knowest, turn and see--
As thou hast power over me
So have I power over these,
Because I wrought them for thy sake,
And breathed in them mine agonies.

Small mirth was in the making--now
I lift the cloth that cloaks the clay,
And, wearied, at thy feet I lay
My wares, ere I go forth to sell.
The long bazar will praise, but thou--
Heart of my heart--have I done well?"
14,A Dedication to Soldiers Three,"And they were stronger hands than mine
That digged the Ruby from the earth--
More cunning brains that made it worth
The large desire of a king,
And stouter hearts that through the brine
Went down the perfect Pearl to bring.

Lo, I have wrought in common clay
Rude figures of a rough-hewn race,
Since pearls strew not the market-place
In this my town of banishment,
Where with the shifting dust I play,
And eat the bread of discontent.

Yet is there life in that I make.
0 thou who knowest, turn and see--
As thou hast power over me
So have I power over these,
Because I wrought them for thy sake,
And breathed in them mine agonies.

Small mirth was in the making--now
I lift the cloth that cloaks the clay,
And, wearied, at thy feet I lay
My wares, ere I go forth to sell.
The long bazaar will praise, but thou--
Heart of my heart--have I done well?"
15,A Departure,"Since first the White Horse Banner blew free,
 By Hengist's horde unfurled,
Nothing has changed on land or sea
 Of the things that steer the world.
(As it was when the long-ships scudded through the gale
 So it is where the Liners go.)
Time and Tide, they are both in a tale--
 ""Woe to the weaker -- woe! ""

No charm can bridle the hard-mouthed wind
 Or smooth the fretting swell.
No gift can alter the grey Sea's mind,
 But she serves the strong man well.
(As it is when her uttermost deeps are stirred
 So it is where the quicksands show,)
All the waters have but one word--
 ""Woe to the weaker -- woe! ""

The feast is ended, the tales are told,
 The dawn is overdue,
And we meet on the quay in the whistling cold
 Where the galley waits her crew.
Out with the torches, they have flared too long,
 And bid the harpers go.
Wind and warfare have but one song--
 ""Woe to the weaker -- woe!""

Hail to the great oars gathering way,
 As the beach begins to slide!
Hail to the war-shields' click and play
 As they lift along our side!
Hail to the first wave over the bow--
 Slow for the sea-stroke! Slow!--
All the benches are grunting now:--
 ""Woe to the weaker -- woe!"""
16,A General Summary,"We are very slightly changed
From the semi-apes who ranged
 India's Prehistoric clay;
He that drew the longest bow
Ran his brother down, you know,
 As we run men down to-day.

""Dowb,"" the first of all his race,
Met the Mammoth face to face
 On the lake or in the cave:
Stole the steadiest canoe,
Ate the quarry others slew,
 Died -- and took the finest grave.

When they scratched the reindeer-bone,
Some one made the sketch his own,
 Filched it from the artist -- then,
Even in those early days,
Won a simple Viceroy's praise
 Through the toil of other men.
Ere they hewed the Sphinx's visage
Favouritism governed kissage,
 Even as it does in this age.

Who shall doubt ""the secret hid
Under Cheops' pyramid""
Was that the contractor did
 Cheops out of several millions?
Or that Joseph's sudden rise
To comptroller of Supplies
Was a fraud of monstrous size
 On King Pharaoh's swart Civilians?

Thus, the artless songs I sing
Do not deal with anything
 New or never said before.
As it was in the beginning
Is to-day official sinning,
 And shall be for evermore!"
