,title,text
24,Maundy Thursday,"Between the brown hands of a server-lad
The silver cross was offered to be kissed.
The men came up, lugubrious, but not sad,
And knelt reluctantly, half-prejudiced.
(And kissing, kissed the emblem of a creed.)
Then mourning women knelt; meek mouths they had,
(And kissed the Body of the Christ indeed.)
Young children came, with eager lips and glad.
(These kissed a silver doll, immensely bright.)
Then I, too, knelt before that acolyte.
Above the crucifix I bent my head:
The Christ was thin, and cold, and very dead:
And yet I bowed, yea, kissed - my lips did cling.
(I kissed the warm live hand that held the thing.)"
25,Mental Cases,"Who are these? Why sit they here in twilight?
Wherefore rock they, purgatorial shadows,
Drooping tongues from jays that slob their relish,
Baring teeth that leer like skulls' teeth wicked?
Stroke on stroke of pain,- but what slow panic,
Gouged these chasms round their fretted sockets?
Ever from their hair and through their hands' palms
Misery swelters. Surely we have perished
Sleeping, and walk hell; but who these hellish?

-These are men whose minds the Dead have ravished.
Memory fingers in their hair of murders,
Multitudinous murders they once witnessed.
Wading sloughs of flesh these helpless wander,
Treading blood from lungs that had loved laughter.
Always they must see these things and hear them,
Batter of guns and shatter of flying muscles,
Carnage incomparable, and human squander
Rucked too thick for these men's extrication.

Therefore still their eyeballs shrink tormented
Back into their brains, because on their sense
Sunlight seems a blood-smear; night comes blood-black;
Dawn breaks open like a wound that bleeds afresh.
-Thus their heads wear this hilarious, hideous,
Awful falseness of set-smiling corpses.
-Thus their hands are plucking at each other;
Picking at the rope-knouts of their scourging;
Snatching after us who smote them, brother,
Pawing us who dealt them war and madness."
26,Miners,"There was a whispering in my hearth,
A sigh of the coal.
Grown wistful of a former earth
It might recall.

I listened for a tale of leaves
And smothered ferns,
Frond-forests; and the low, sly lives
Before the fawns.

My fire might show steam-phantoms simmer
From Time's old cauldron,
Before the birds made nests in summer,
Or men had children.

But the coals were murmuring of their mine,
And moans down there
Of boys that slept wry sleep, and men
Writhing for air.

And I saw white bones in the cinder-shard,
Bones without number.
For many hearts with coal are charred,
And few remember.

I thought of all that worked dark pits
Of war, and died
Digging the rock where Death reputes
Peace lies indeed.

Comforted years will sit soft-chaired
In rooms of amber;
The years will stretch their hands, well-cheered
By our lifes' ember.

The centuries will burn rich loads
With which we groaned,
Whose warmth shall lull their dreaming lids,
While songs are crooned.
But they will not dream of us poor lads
Left in the ground."
27,Music,"I have been urged by earnest violins
And drunk their mellow sorrows to the slake
Of all my sorrows and my thirsting sins.
My heart has beaten for a brave drum's sake.
Huge chords have wrought me mighty: I have hurled
Thuds of gods' thunder. And with old winds pondered
Over the curse of this chaotic world,-
With low lost winds that maundered as they wandered.

I have been gay with trivial fifes that laugh;
And songs more sweet than possible things are sweet;
And gongs, and oboes. Yet I guessed not half
Life's symphony till I had made hearts beat,
And touched Love's body into trembling cries,
And blown my love's lips into laughs and sighs."
28,My Shy Hand,"My shy hand shades a hermitage apart, -
      O large enough for thee, and thy brief hours.
Life there is sweeter held than in God's heart,
      Stiller than in the heavens of hollow flowers.


The wine is gladder there than in gold bowls.
      And Time shall not drain thence, nor trouble spill.
Sources between my fingers feed all souls,
      Where thou mayest cool thy lips, and draw thy fill.


Five cushions hath my hand, for reveries;
      And one deep pillow for thy brow's fatigues;
Languor of June all winterlong, and ease
      For ever from the vain untravelled leagues.


Thither your years may gather in from storm,
And Love, that sleepeth there, will keep thee warm."
29,On My Songs,"Though unseen Poets, many and many a time,
Have answered me as if they knew my woe,
And it might seem have fashioned so their rime
To be my own soul's cry; easing the flow
Of my dumb tears with language sweet as sobs,
Yet are there days when all these hoards of thought
Hold nothing for me. Not one verse that throbs
Throbs with my heart, or as my brain is fraught.
'Tis then I voice mine own weird reveries:
Low croonings of a motherless child, in gloom
Singing his frightened self to sleep, are these.
One night, if thou shouldst lie in this Sick Room,
Dreading the Dark thou darest not illume,
Listen; my voice may haply lend thee ease."
30,Red lips are not so red,"Red lips are not so red
  As the stained stones kissed by the English dead.
Kindness of wooed and wooer
Seems shame to their love pure.
O Love, your eyes lose lure
  When I behold eyes blinded in my stead!

Your slender attitude
  Trembles not exquisite like limbs knife-skewed,
Rolling and rolling there
Where God seems not to care;
Till the fierce Love they bear
  Cramps them in death's extreme decrepitude.

Your voice sings not so soft, --
  Though even as wind murmuring through raftered loft, --
Your dear voice is not dear,
Gentle, and evening clear,
As theirs whom none now hear
  Now earth has stopped their piteous mouths that coughed.

Heart, you were never hot,
  Nor large, nor full like hearts made great with shot;
And though your hand be pale,
Paler are all which trail
Your cross through flame and hail:
  Weep, you may weep, for you may touch them not."
31,S.I.W.," ""I will to the King,
   And offer him consolation in his trouble,
   For that man there has set his teeth to die,
   And being one that hates obedience,
   Discipline, and orderliness of life,
   I cannot mourn him.""
                           -- W. B. Yeats.


Patting goodbye, doubtless they told the lad
He'd always show the Hun a brave man's face;
Father would sooner him dead than in disgrace, --
Was proud to see him going, aye, and glad.
Perhaps his Mother whimpered how she'd fret
Until he got a nice, safe wound to nurse.
Sisters would wish girls too could shoot, charge, curse, . . .
Brothers -- would send his favourite cigarette,
Each week, month after month, they wrote the same,
Thinking him sheltered in some Y.M. Hut,
Where once an hour a bullet missed its aim
And misses teased the hunger of his brain.
His eyes grew old with wincing, and his hand
Reckless with ague.  Courage leaked, as sand
From the best sandbags after years of rain.
But never leave, wound, fever, trench-foot, shock,
Untrapped the wretch.  And death seemed still withheld
For torture of lying machinally shelled,
At the pleasure of this world's Powers who'd run amok.

He'd seen men shoot their hands, on night patrol,
Their people never knew.  Yet they were vile.
""Death sooner than dishonour, that's the style!""
So Father said.

                One dawn, our wire patrol
Carried him.  This time, Death had not missed.
We could do nothing, but wipe his bleeding cough.
Could it be accident? --  Rifles go off . . .
Not sniped? No. (Later they found the English ball.)

It was the reasoned crisis of his soul.
Against the fires that would not burn him whole
But kept him for death's perjury and scoff
And life's half-promising, and both their riling.

With him they buried the muzzle his teeth had kissed,
And truthfully wrote the Mother ""Tim died smiling."""
32,Schoolmistress,"Schoolmistress
Having, with bold Horatius, stamped her feet
And waved a final swashing arabesque
O'er the brave days of old, she ceased to bleat,
Slapped her Macaulay back upon the desk,
Resuned her calm gaze and her lofty seat.

There, while she heard the classic lines repeat,
Once more the teacher's face clenched stern;
For through the window, looking on the street,
Three soldiers hailed her. She made no return.
One was called 'Orace whom she would not greet."
33,Shadwell Stair,"I am the ghost of Shadwell Stair.
      Along the wharves by the water-house,
      And through the cavernous slaughter-house,
I am the shadow that walks there.


Yet I have flesh both firm and cool,
      And eyes tumultuous as the gems
      Of moons and lamps in the full Thames
When dusk sails wavering down the pool.


Shuddering the purple street-arc burns
      Where I watch always; from the banks
      Dolorously the shipping clanks
And after me a strange tide turns.


I walk till the stars of London wane
      And dawn creeps up the Shadwell Stair.
      But when the crowing syrens blare
I with another ghost am lain."
34,Six o'clock in Princes Street,"In twos and threes, they have not far to roam,
Crowds that thread eastward, gay of eyes;
Those seek no further than their quiet home,
Wives, walking westward, slow and wise.

Neither should I go fooling over clouds,
Following gleams unsafe, untrue,
And tiring after beauty through star-crowds,
Dared I go side by side with you;

Or be you in the gutter where you stand,
Pale rain-flawed phantom of the place,
With news of all the nations in your hand,
And all their sorrows in your face."
35,"Smile, Smile, Smile","Head to limp head, the sunk-eyed wounded scanned
Yesterday's Mail; the casualties (typed small)
And (large) Vast Booty from our Latest Haul.
Also, they read of Cheap Homes, not yet planned;
For, said the paper, ""When this war is done
The men's first instinct will be making homes.
Meanwhile their foremost need is aerodromes,
It being certain war has just begun.
Peace would do wrong to our undying dead, --
The sons we offered might regret they died
If we got nothing lasting in their stead.
We must be solidly indemnified.
Though all be worthy Victory which all bought,
We rulers sitting in this ancient spot
Would wrong our very selves if we forgot
The greatest glory will be theirs who fought,
Who kept this nation in integrity.""
Nation? --  The half-limbed readers did not chafe
But smiled at one another curiously
Like secret men who know their secret safe.
This is the thing they know and never speak,
That England one by one had fled to France
(Not many elsewhere now save under France).
Pictures of these broad smiles appear each week,
And people in whose voice real feeling rings
Say:  How they smile!  They're happy now, poor things."
36,Soldier's Dream,"I dreamed kind Jesus fouled the big-gun gears;
And caused a permanent stoppage in all bolts;
And buckled with a smile Mausers and Colts;
And rusted every bayonet with His tears.

And there were no more bombs, of ours or Theirs,
Not even an old flint-lock, not even a pikel.
But God was vexed, and gave all power to Michael;
And when I woke he'd seen to our repairs."
37,Song of Songs,"Sing me at morn but only with your laugh;
Even as Spring that laugheth into leaf;
Even as Love that laugheth after Life.


Sing me but only with your speech all day,
As voluble leaflets do; let viols die;
The least word of your lips is melody!


Sing me at eve but only your sigh!
Like lifting seas it solaceth; breathe so,
Slowly and low, the sense that no songs say.


Sing me at midnight with your murmurous heart!
Let youth's immortal-moaning chord be heard
Throbbing through you, and sobbing, unsubdued."
38,Sonnet to my Friend - with an Identity Disc,"If ever I had dreamed of my dead name
High in the heart of London, unsurpassed
By Time for ever, and the Fugitive, Fame,
There seeking a long sanctuary at last, -


Or if I onetime hoped to hide its shame,
- Shame of success, and sorrow of defeats, -
Under those holy cypresses, the same
That shade always the quiet place of Keats,


Now rather thank I God there is no risk
Of gravers scoring it with florid screed.
Let my inscription be this soldier's disc.
Wear it, sweet friend. Inscribe no date nor deed.
But may thy heart-beat kiss it, night and day,
Until the name grow blurred and fade away."
39,Sonnet: On Seeing a Piece of Our Heavy...,"Be slowly lifted up, thou long black arm,
Great Gun towering towards Heaven, about to curse;
Sway steep against them, and for years rehearse
Huge imprecations like a blasting charm!
Reach at that Arrogance which needs thy harm,
And beat it down before its sins grow worse.
Spend our resentment, cannon, -- yea, disburse
Our gold in shapes of flame, our breaths in storm.

Yet, for men's sakes whom thy vast malison
Must wither innocent of enmity,
Be not withdrawn, dark arm, thy spoilure done,
Safe to the bosom of our prosperity.
But when thy spell be cast complete and whole,
May God curse thee, and cut thee from our soul!"
40,Spells and Incantations,"A vague pearl, a wan pearl
You showed me once; I peered through far-gone winters
Until my mind was fog-bound in that gem.

Blue diamonds, cold diamonds
You shook before me, so that out of them
Glittered and glowed vast diamond dawns of spring.

Tiger-eyed rubies, wrathful rubies
You rolled. I watched their hot hearts fling
Flames from each glaring summer of my life.

Quiet amber, mellow amber
You lifted; and behold the whole air rife
With evening, and the auburn autumn cloud.

But pale skin, your pearl skin
Show this to me, and I shall have surprise
Of every snow-lit dawn before it break.

But clear eyes, your fresh eyes
Open; that I may laugh, and lightly take
All air of early April in one hour.

But brown curls, O shadow me with curls,
Full of September mist, half-gleam, half-glower,
And I shall roam warm nights in lands far south."
41,Spring Offensive [unfinished],"Halted against the shade of a last hill,
They fed, and lying easy, were at ease
And, finding comfortable chests and knees,
Carelessly slept. But many there stood still
To face the stark blank sky beyond the ridge,
Knowing their feet had come to the end of the world.


Marvelling they stood, and watched the long grass swirled
By the May breeze, murmurous with wasp and midge,
For though the summer oozed into their veins
Like an injected drug for their bodies' pains,
Sharp on their souls hung the imminent line of grass,
Fearfully flashed the sky's mysterious glass.


Hour after hour they ponder the warm field, -
And the far valley behind, where the buttercup
Had blessed with gold their slow boots coming up,
Where even the little brambles would not yield
But clutched and clung to them like sorrowing hands.
[          ] they breathe like trees unstirred.


Till like a cold gust thrills the little word
At which each body and its soul begird
And tighten them for battle. No alarms
Of bugles, no high flags, no clamorous haste, -
Only a lift and flare of eyes that faced
The sun, like a friend with whom their love is done.
O larger shone that smile against the sun, -
Mightier than his whose bounty these have spurned.


So, soon they topped the hill, and raced together
Over an open stretch of herb and heather
Exposed. And instantly the whole sky burned
With fury against them; earth set sudden cups
In thousands for their blood; and the green slope
Chasmed and steepened sheer to infinite space.


Of them who running on that last high place
Leapt to swift unseen bullets, or went up
On the hot blast and fury of hell's upsurge,
Or plunged and fell away past this world's verge,
Some say God caught them even before they fell.


But what say such as from existence' brink
Ventured but drave too swift to sink,
The few who rushed in the body to enter hell,
And there out-fiending all its fiends and flames
With superhuman inhumanities,
Long-famous glories, immemorial shames -
And crawling slowly back, have by degrees
Regained cool peaceful air in wonder -
Why speak not they of comrades that went under?"
42,Storm,"His face was charged with beauty as a cloud
      With glimmering lightning. When it shadowed me
      I shook, and was uneasy as a tree
That draws the brilliant danger, tremulous, bowed.


So must I tempt that face to loose its lightning.
      Great gods, whose beauty is death, will laugh above,
      Who made his beauty lovelier than love.
I shall be bright with their unearthly brightening.


And happier were it if my sap consume;
Glorious will shine the opening of my heart;
The land shall freshen that was under gloom;
What matter if all men cry aloud and start,
And women hide bleak faces in their shawl,
At those hilarious thunders of my fall?"
43,Strange Meeting,"It seemed that out of the battle I escaped
Down some profound dull tunnel, long since scooped
Through granites which Titanic wars had groined.
Yet also there encumbered sleepers groaned,
Too fast in thought or death to be bestirred.
Then, as I probed them, one sprang up, and stared
With piteous recognition in fixed eyes,
Lifting distressful hands as if to bless.
And by his smile, I knew that sullen hall;
And by his dead smile I knew we stood in Hell.
 With a thousand fears that vision's face was grained;
 Yet no blood reached there from the upper ground,
 And no guns thumped, or down the fluies made moan.
 ""Strange, friend,"" I said, ""Here is no cause to mourn.""
 ""None,"" said the other, ""Save the undone years,
 The hopelessness. Whatever hope is yours,
 Was my life also; I went hunting wild
 After the wildest beauty in the world,
 Which lies not calm in eyes, or braided hair,
 But mocks the steady running of the hour,
 And if it grieves, grieves richlier than here.
 For by my glee might many men have laughed,
 And of my weeping something has been left,
 Which must die now. I mean the truth untold,
 The pity of war, the pity war distilled.
 Now men will go content with what we spoiled.
 Or, discontent, boil bloody, and be spilled.
 They will be swift with swiftness of the tigress,
 None will break ranks, though nations trek from progress.
 Courage was mine, and I had mystery;
 Wisdom was mine, and I had mastery;
 To miss the march of this retreating world
 Into vain citadels that are not walled.
 Then, when much blood had clogged their chariot-wheels
 I would go up and wash them from sweet wells,
 Even with truths that lie too deep for taint.
 I would have poured my spirit without stint
 But not through wounds; not on the cess of war.
 Foreheads of men have bled where no wounds were.
 I am the enemy you killed, my friend.
 I knew you in this dark; for so you frowned
 Yesterday through me as you jabbed and killed.
 I parried; but my hands were loath and cold.
 Let us sleep now ..."
44,The Calls [unfinished],"A dismal fog-hoarse siren howls at dawn.
I watch the man it calls for, pushed and drawn
Backwards and forwards, helpless as a pawn.
But I'm lazy, and his work's crazy.

Quick treble bells begin at nine o'clock,
Scuttling the schoolboy pulling up his sock,
Scaring the late girl in the inky frock.
I must be crazy; I learn from the daisy.

Stern bells annoy the rooks and doves at ten.
I watch the verger close the doors, and when
I hear the organ moan the first amen,
Sing my religion's-same as pigeons'.

A blatant bugle tears my afternoons.
Out clump the clumsy Tommies by platoons,
Trying to keep in step with rag-time tunes,
But I sit still; I've done my drill.

Gongs hum and buzz like saucepan-lids at dusk,
I see a food-hog whet his gold-filled tusk
To eat less bread, and more luxurious rusk.

Then sometimes late at night my window bumps
From gunnery-practice, till my small heart thumps
And listens for the shell-shrieks and the crumps,
But that's not all.

For leaning out last midnight on my sill
I heard the sighs of men, that have no skill
To speak of their distress, no, nor the will!
A voice I know. And this time I must go."
45,The Chances,"I mind as 'ow the night afore that show
Us five got talking, -- we was in the know,
""Over the top to-morrer; boys, we're for it,
First wave we are, first ruddy wave; that's tore it.""
""Ah well,"" says Jimmy, -- an' 'e's seen some scrappin' --
""There ain't more nor five things as can 'appen;
Ye get knocked out; else wounded -- bad or cushy;
Scuppered; or nowt except yer feeling mushy.""

One of us got the knock-out, blown to chops.
T'other was hurt, like, losin' both 'is props.
An' one, to use the word of 'ypocrites,
'Ad the misfortoon to be took by Fritz.
Now me, I wasn't scratched, praise God Almighty
(Though next time please I'll thank 'im for a blighty),
But poor young Jim, 'e's livin' an' 'e's not;
'E reckoned 'e'd five chances, an' 'e's 'ad;
'E's wounded, killed, and pris'ner, all the lot --
The ruddy lot all rolled in one. Jim's mad."
46,The Dead Beat,"He dropped, - more sullenly than wearily,
Lay stupid like a cod, heavy like meat,
And none of us could kick him to his feet;
- Just blinked at my revolver, blearily;
- Didn't appear to know a war was on,
Or see the blasted trench at which he stared.
'I'll do 'em in,' he whined, 'if this hand's spared,
I'll murder them, I will.'

A low voice said,
'It's Blighty, p'raps, he sees; his pluck's all gone,
Dreaming of all the valiant, that aren't dead:
Bold uncles, smiling ministerially;
Maybe his brave young wife, getting her fun
In some new home, improved materially.
It's not these stiffs have crazed him; nor the Hun.'

We sent him down at last, out of the way.
Unwounded; - stout lad, too, before that strafe.
Malingering? Stretcher-bearers winked, 'Not half!'

Next day I heard the Doc.'s well-whiskied laugh:
'That scum you sent last night soon died. Hooray!'"
47,The End,"After the blast of lightning from the east,
The flourish of loud clouds, the Chariot throne,
After the drums of time have rolled and ceased
And from the bronze west long retreat is blown,

Shall Life renew these bodies? Of a truth
All death will he annul, all tears assuage?
Or fill these void veins full again with youth
And wash with an immortal water age?

When I do ask white Age, he saith not so, --
""My head hangs weighed with snow.""
And when I hearken to the Earth she saith
My fiery heart sinks aching.  It is death.
Mine ancient scars shall not be glorified
Nor my titanic tears the seas be dried."""
48,The Kind Ghosts,"She sleeps on soft, last breaths; but no ghost looms
Out of the stillness of her palace wall,
Her wall of boys on boys and dooms on dooms.

She dreams of golden gardens and sweet glooms,
Not marvelling why her roses never fall
Nor what red mouths were torn to make their blooms.

The shades keep down which well might roam her hall.
Quiet their blood lies in her crimson rooms
And she is not afraid of their footfall.

They move not from her tapestries, their pall,
Nor pace her terraces, their hecatombs,
Lest aught she be disturbed, or grieved at all."
49,The Last Laugh,"'Oh! Jesus Christ! I'm hit,' he said; and died.
Whether he vainly cursed or prayed indeed,
The Bullets chirped-In vain, vain, vain!
Machine-guns chuckled,-Tut-tut! Tut-tut!
And the Big Gun guffawed.

Another sighed,-'O Mother, -Mother, - Dad!'
Then smiled at nothing, childlike, being dead.
And the lofty Shrapnel-cloud
Leisurely gestured,-Fool!
And the splinters spat, and tittered.

'My Love!' one moaned. Love-languid seemed his mood,
Till slowly lowered, his whole faced kissed the mud.
And the Bayonets' long teeth grinned;
Rabbles of Shells hooted and groaned;
And the Gas hissed."
50,The Letter,"With B.E.F. Jun 10. Dear Wife,
(Oh blast this pencil. 'Ere, Bill, lend's a knife.)
I'm in the pink at present, dear.
I think the war will end this year.
We don't see much of them square-'eaded 'Uns.
We're out of harm's way, not bad fed.
I'm longing for a taste of your old buns.
(Say, Jimmie, spare's a bite of bread.)
There don't seem much to say just now.
(Yer what? Then don't, yer ruddy cow!
And give us back me cigarette!)
I'll soon be 'ome. You mustn't fret.
My feet's improvin', as I told you of.
We're out in the rest now. Never fear.
(VRACH! By crumbs, but that was near.)
Mother might spare you half a sov.
Kiss Nell and Bert. When me and you-
(Eh? What the 'ell! Stand to? Stand to!
Jim, give's a hand with pack on, lad.
Guh! Christ! I'm hit. Take 'old. Aye, bad.
No, damn your iodine. Jim? 'Ere!
Write my old girl, Jim, there's a dear.)"
51,The Next War,"War's a joke for me and you,
Wile we know such dreams are true.
- Siegfried Sassoon

Out there, we've walked quite friendly up to Death,-
Sat down and eaten with him, cool and bland,-
Pardoned his spilling mess-tins in our hand.
We've sniffed the green thick odour of his breath,-
Our eyes wept, but our courage didn't writhe.
He's spat at us with bullets and he's coughed
Shrapnel. We chorussed when he sang aloft,
We whistled while he shaved us with his scythe.

Oh, Death was never enemy of ours!
We laughed at him, we leagued with him, old chum.
No soldier's paid to kick against His powers.
We laughed, -knowing that better men would come,
And greater wars: when each proud fighter brags
He wars on Death, for lives; not men, for flags."
