,title,text
0,1914,"War broke: and now the Winter of the world
With perishing great darkness closes in.
The foul tornado, centred at Berlin,
Is over all the width of Europe whirled,
Rending the sails of progress. Rent or furled
Are all Art's ensigns. Verse wails. Now begin
Famines of thought and feeling. Love's wine's thin.
The grain of human Autumn rots, down-hurled.

For after Spring had bloomed in early Greece,
And Summer blazed her glory out with Rome,
An Autumn softly fell, a harvest home,
A slow grand age, and rich with all increase.
But now, for us, wild Winter, and the need
Of sowings for new Spring, and blood for seed."
1,A New Heaven,"Seeing we never found gay fairyland
(Though still we crouched by bluebells moon by moon)
And missed the tide of Lethe; yet are soon
For that new bridge that leaves old Styx half-spanned;
Nor ever unto Mecca caravanned;
Nor bugled Asgard, skilled in magic rune;
Nor yearned for far Nirvana, the sweet swoon,
And from high Paradise are cursed and banned;

-Let's die home, ferry across the Channel! Thus
Shall we live gods there. Death shall be no sev'rance.
Weary cathedrals light new shrines for us.
To us, rough knees of boys shall ache with rev'rence.
Are not girls' breasts a clear, strong Acropole?
-There our oun mothers' tears shall heal us whole."
2,A Terre (being the philosophy of many soldiers),"Sit on the bed. I'm blind, and three parts shell.
Be careful; can't shake hands now; never shall.
Both arms have mutinied against me,-brutes.
My fingers fidget like ten idle brats.

I tried to peg out soldierly,-no use!
One dies of war like any old disease.
This bandage feels like pennies on my eyes.
I have my medals?-Discs to make eyes close.
My glorious ribbons?-Ripped from my own back
In scarlet shreds. (That's for your poetry book.)

A short life and a merry one, my buck!
We used to say we'd hate to live dead-old,-
Yet now...I'd willingly be puffy, bald,
And patriotic. Buffers catch from boys
At least the jokes hurled at them. I suppose
Little I'd ever teach a son, but hitting,
Shooting, war, hunting, all the arts of hurting.
Well, that's what I learnt,-that, and making money.

Your fifty years ahead seem none too many?
Tell me how long I've got? God! For one year
To help myself to nothing more than air!
One Spring! Is one too good to spare, too long?
Spring wind would work its own way to my lung,
And grow me legs as quick as lilac-shoots.

My servant's lamed, but listen how he shouts!
When I'm lugged out, he'll still be good for that.
Here in this mummy-case, you know, I've thought
How well I might have swept his floors for ever.
I'd ask no nights off when the bustle's over,
Enjoying so the dirt. Who's prejudiced
Against a grimed hand when his own's quite dust,
Less live than specks that in the sun-shafts turn,
Less warm than dust that mixes with arms' tan?
I'd love to be a sweep, now, black as Town,
Yes, or a muckman. Must I be his load?

O Life, Life, let me breathe,-a dug-out rat!
Not worse than ours the lives rats lead-
Nosing along at night down some safe rut,
They find a shell-proof home before they rot.
Dead men may envy living mites in cheese,
Or good germs even. Microbes have their joys,
And subdivide, and never come to death.
Certainly flowers have the easiest time on earth.
'I shall be one with nature, herb, and stone'
Shelley would tell me. Shelley would be stunned:
The dullest Tommy hugs that fancy now.
'Pushing up daisies' is their creed, you know.

To grain, then, go my fat, to buds my sap,
For all the usefulness there is in soap.
D'you think the Boche will ever stew man-soup?
Some day, no doubt, if...Friend, be very sure
I shall be better off with plants that share
More peaceably the meadow and the shower.
Soft rains will touch me,-as they could touch once,
And nothing but the sun shall make me ware.
Your guns may crash around me. I'll not hear;
Or, if I wince, I shall not know I wince.

Don't take my soul's poor comfort for your jest.
Soldiers may grow a soul when turned to fronds,
But here's the thing's best left at home with friends.

My soul's a little grief, grappling your chest,
To climb your throat on sobs; easily chased
On other sighs and wiped by fresher winds.

Carry my crying spirit till it's weaned
To do without what blood remained these wounds."
3,Anthem for Doomed Youth,"What passing-bells for these who die as cattle?
    Only the monstrous anger of the guns.
    Only the stuttering rifles' rapid rattle
Can patter out their hasty orisons.
No mockeries for them; no prayers nor bells,
Nor any voice of mourning save the choirs,--
The shrill, demented choirs of wailing shells;
And bugles calling for them from sad shires.
What candles may be held to speed them all?
     Not in the hands of boys, but in their eyes
 Shall shine the holy glimmers of goodbyes.
     The pallor of girls' brows shall be their pall;
 Their flowers the tenderness of patient minds,
 And each slow dusk a drawing-down of blinds."
4,Apologia Pro Poemate Meo,"I, too, saw God through mud--
The mud that cracked on cheeks when wretches smiled.
War brought more glory to their eyes than blood,
And gave their laughs more glee than shakes a child.

Merry it was to laugh there--
Where death becomes absurd and life absurder.
For power was on us as we slashed bones bare
Not to feel sickness or remorse of murder.

I, too, have dropped off fear--
Behind the barrage, dead as my platoon,
And sailed my spirit surging, light and clear,
Past the entanglement where hopes lie strewn;

And witnessed exhultation--
Faces that used to curse me, scowl for scowl,
Shine and lift up with passion of oblation,
Seraphic for an hour, though they were foul.

I have made fellowships--
Untold of happy lovers in old song.
For love is not the binding of fair lips
With the soft silk of eyes that look and long.

By joy, whose ribbon slips,--
But wound with war's hard wire whose stakes are strong;
Bound with the bandage of the arm that drips;
Knit in the welding of the rifle-thong.

I have perceived much beauty
In the hoarse oaths that kept our courage straight;
Heard music in the silentness of duty;
Found peace where shell-storms spouted reddest spate.

Nevertheless, except you share
With them in hell the sorrowful dark of hell,
Whose world is but a trembling of a flare
And heaven but a highway for a shell,

You shall not hear their mirth:
You shall not come to think them well content
By any jest of mine. These men are worth
Your tears: You are not worth their merriment."
5,Arms and the Boy," Let the boy try along this bayonet-blade
How cold steel is, and keen with hunger of blood;
Blue with all malice, like a madman's flash;
And thinly drawn with famishing for flesh.
Lend him to stroke these blind, blunt bullet-heads
Which long to muzzle in the hearts of lads.
Or give him cartridges of fine zinc teeth,
Sharp with the sharpness of grief and death.
For his teeth seem for laughing round an apple.
  There lurk no claws behind his fingers supple;
  And God will grow no talons at his heels,
  Nor antlers through the thickness of his curls."
6,Asleep,"Under his helmet, up against his pack,
After so many days of work and waking,
Sleep took him by the brow and laid him back.

There, in the happy no-time of his sleeping,
Death took him by the heart. There heaved a quaking
Of the aborted life within him leaping,
Then chest and sleepy arms once more fell slack.

And soon the slow, stray blood came creeping
From the intruding lead, like ants on track.

Whether his deeper sleep lie shaded by the shaking
Of great wings, and the thoughts that hung the stars,
High-pillowed on calm pillows of God's making,
Above these clouds, these rains, these sleets of lead,
And these winds' scimitars,
-Or whether yet his thin and sodden head
Confuses more and more with the low mould,
His hair being one with the grey grass
Of finished fields, and wire-scrags rusty-old,
Who knows? Who hopes? Who troubles? Let it pass!
He sleeps. He sleeps less tremulous, less cold,
Than we who wake, and waking say Alas!"
7,At a Calvary Near the Ancre,"One ever hangs where shelled roads part.
In this war He too lost a limb,
But His disciples hide apart;
And now the Soldiers bear with Him.

Near Golgotha strolls many a priest,
And in their faces there is pride
That they were flesh-marked by the Beast
By whom the gentle Christ's denied

The scribes on all the people shove
And bawl allegiance to the state,
But they who love the greater love
Lay down their life; they do not hate"
8,Beauty: [Notes for an unfinished poem],"The beautiful, the fair, the elegant,
Is that which pleases us, says Kant,
Without a thought of interest or advantage.

I used to watch men when they spoke of beauty
And measure their enthusiasm. One
An old man, seeing a ( ) setting sun,
Praised it ( ) a certain sense of duty
To the calm evening and his time of life.
I know another man that never says a Beauty
But of a horse; ( )

Men seldom speak of beauty, beauty as such,
Not even lovers think about it much.
Women of course consider it for hours
In mirrors; ( )

A shrapnel ball -
Just where the wet skin glistened when he swam -
Like a fully-opened sea-anemone.
We both said 'What a beauty! What a beauty, lad'
I knew that in that flower he saw a hope
Of living on, and seeing again the roses of his home.
Beauty is that which pleases and delights,
Not bringing personal advantage - Kant.
But later on I heard
A canker worked into that crimson flower
And that he sank with it
And laid it with the anemones off Dover."
9,But I Was Looking at the Permanent Stars,"Bugles sang, saddening the evening air,
And bugles answered, sorrowful to hear.

Voices of boys were by the river-side.
Sleep mothered them; and left the twilight sad.
The shadow of the morrow weighed on men.

Voices of old despondency resigned,
Bowed by the shadow of the morrow, slept.

( ) dying tone
Of receding voices that will not return.
The wailing of the high far-travelling shells
And the deep cursing of the provoking ( )

The monstrous anger of our taciturn guns.
The majesty of the insults of their mouths."
10,Conscious,"His fingers wake, and flutter; up the bed.
His eyes come open with a pull of will,
Helped by the yellow mayflowers by his head.
The blind-cord drawls across the window-sill...
What a smooth floor the ward has! What a rug!
Who is that talking somewhere out of sight?
Three flies creeping round the shiny jug...
'Nurse! Doctor!'-'Yes; all right, all right.'

But sudden evening muddles all the air.
There seems no time to want a drink of water.
Nurse looks so far away. And here and there
Music and roses burst through crimson slaughter.
He can't remember where he saw blue sky...
The trench is narrower. Cold, he's cold; yet hot --
And there's no light to see the voices by...
There is no time to ask... he knows not what."
11,Disabled,"He sat in a wheeled chair, waiting for dark,
And shivered in his ghastly suit of grey,
Legless, sewn short at elbow. Through the park
Voices of boys rang saddening like a hymn,
Voices of play and pleasure after day,
Till gathering sleep had mothered them from him.

About this time Town used to swing so gay
When glow-lamps budded in the light blue trees,
And girls glanced lovelier as the air grew dim,-
In the old times, before he threw away his knees.
Now he will never feel again how slim
Girls' waists are, or how warm their subtle hands.
All of them touch him like some queer disease.

There was an artist silly for his face,
For it was younger than his youth, last year.
Now, he is old; his back will never brace;
He's lost his colour very far from here,
Poured it down shell-holes till the veins ran dry,
And half his lifetime lapsed in the hot race
And leap of purple spurted from his thigh.

One time he liked a blood-smear down his leg,
After the matches, carried shoulder-high.
It was after football, when he'd drunk a peg,
He thought he'd better join. - He wonders why.
Someone had said he'd look a god in kilts,
That's why; and maybe, too, to please his Meg,
Aye, that was it, to please the giddy jilts
He asked to join. He didn't have to beg;
Smiling they wrote his lie: aged nineteen years.

Germans he scarcely thought of; all their guilt,
And Austria's, did not move him. And no fears
Of Fear came yet. He drought of jewelled hills
For daggers in plaid socks; of smart salutes;
And care of arms; and leave; and pay arrears;
Esprit de corps; and hints for young recruits.
And soon, he was drafted out with drums and cheers.

Some cheered him home, but not as crowds cheer Goal.
Only a solemn man who brought him fruits
Thanked him; and then enquired about his soul.

Now, he will spend a few sick years in institutes,
And do what things the rules consider wise,
And take whatever pity they may dole.
Tonight he noticed how the women's eyes
Passed from him to the strong men that were whole.
How cold and late it is! Why don't they come
And put him into bed? Why don't they come?"
12,Dulce et Decorum Est,"Bent double, like old beggars under sacks,
Knock-kneed, coughing like hags, we cursed through sludge,
Till on the haunting flares we turned our backs,
And towards our distant rest began to trudge.
Men marched asleep. Many had lost their boots,
But limped on, blood-shod. All went lame, all blind;
Drunk with fatigue; deaf even to the hoots
Of gas-shells dropping softly behind.


Gas! GAS! Quick, boys!--An ecstasy of fumbling
Fitting the clumsy helmets just in time,
But someone still was yelling out and stumbling
And flound'ring like a man in fire or lime.--
Dim through the misty panes and thick green light,
As under a green sea, I saw him drowning.
In all my dreams before my helpless sight
He plunges at me, guttering, choking, drowning.


If in some smothering dreams, you too could pace
Behind the wagon that we flung him in,
And watch the white eyes writhing in his face,
His hanging face, like a devil's sick of sin,
If you could hear, at every jolt, the blood
Come gargling from the froth-corrupted lungs
Bitter as the cud
Of vile, incurable sores on innocent tongues,--
My friend, you would not tell with such high zest
To children ardent for some desperate glory,
The old Lie: Dulce et decorum est
Pro patria mori."
13,Elegy in April and September,"Hush, thrush! Hush, missen-thrush, I listen...
I heard the flush of footsteps through the loose leaves,
And a low whistle by the water's brim.

Still! Daffodil! Nay, hail me not so gaily,-
Your gay gold lily daunts me and deceives,
Who follow gleams more golden and more slim.

Look, brook! O run and look, O run!
The vain reeds shook? - Yet search till gray sea heaves,
And I will stray among these fields for him.

Gaze, daisy! Stare through haze and glare,
And mark the hazardous stars all dawns and eves,
For my eye withers, and his star wanes dim.


2

Close, rose, and droop, heliotrope,
And shudder, hope! The shattering winter blows.
Drop, heliotrope, and close, rose...

Mourn, corn, and sigh, rye.
Men garner you, but youth's head lies forlorn.
Sigh, rye, and mourn, corn...

Brood, wood, and muse, yews,
The ways gods use we have not understood.
Muse, yews, and brood, wood..."
14,Exposure,"I
Our brains ache, in the merciless iced east winds that knife us ...
Wearied we keep awake because the night is silent ...
Low drooping flares confuse our memory of the salient ...
Worried by silence, sentries whisper, curious, nervous,
  But nothing happens.
Watching, we hear the mad gusts tugging on the wire.
Like twitching agonies of men among its brambles.
Northward incessantly, the flickering gunnery rumbles,
Far off, like a dull rumour of some other war.
    What are we doing here?
  The poignant misery of dawn begins to grow ...
  We only know war lasts, rain soaks, and clouds sag stormy.
  Dawn massing in the east her melancholy army
  Attacks once more in ranks on shivering ranks of gray,
    But nothing happens.
  Sudden successive flights of bullets streak the silence.
  Less deadly than the air that shudders black with snow,
  With sidelong flowing flakes that flock, pause and renew,
  We watch them wandering up and down the wind's nonchalance,
    But nothing happens.

II
  Pale flakes with lingering stealth come feeling for our faces--
  We cringe in holes, back on forgotten dreams, and stare, snow-dazed,
  Deep into grassier ditches. So we drowse, sun-dozed,
  Littered with blossoms trickling where the blackbird fusses.
    Is it that we are dying?
  Slowly our ghosts drag home: glimpsing the sunk fires glozed
  With crusted dark-red jewels; crickets jingle there;
  For hours the innocent mice rejoice: the house is theirs;
  Shutters and doors all closed: on us the doors are closed--
    We turn back to our dying.
  Since we believe not otherwise can kind fires burn;
  Now ever suns smile true on child, or field, or fruit.
  For God's invincible spring our love is made afraid;
  Therefore, not loath, we lie out here; therefore were born,
    For love of God seems dying.
  To-night, His frost will fasten on this mud and us,
  Shrivelling many hands and puckering foreheads crisp.
  The burying-party, picks and shovels in their shaking grasp,
  Pause over half-known faces. All their eyes are ice,
    But nothing happens."
15,"From My Diary, July 1914","Leaves
            Murmuring by miriads in the shimmering trees.
Lives
            Wakening with wonder in the Pyrenees.
Birds
            Cheerily chirping in the early day.
Bards
            Singing of summer, scything thro' the hay.
Bees
            Shaking the heavy dews from bloom and frond.
Boys
            Bursting the surface of the ebony pond.
Flashes
            Of swimmers carving thro' the sparkling cold.
Fleshes
            Gleaming with wetness to the morning gold.
A mead
            Bordered about with warbling water brooks.
A maid
            Laughing the love-laugh with me; proud of looks.
The heat
            Throbbing between the upland and the peak.
Her heart
            Quivering with passion to my pressed cheek.
Braiding
            Of floating flames across the mountain brow.
Brooding
            Of stillness; and a sighing of the bough.
Stirs
            Of leaflets in the gloom; soft petal-showers;
Stars
            Expanding with the starr'd nocturnal flowers."
16,Futility," Move him into the sun--
Gently its touch awoke him once,
At home, whispering of fields unsown.
Always it awoke him, even in France,
Until this morning and this snow.
If anything might rouse him now
The kind old sun will know.
Think how it wakes the seeds--
Woke, once, the clays of a cold star.
  Are limbs so dear-achieved, are sides
  Full-nerved,--still warm,--too hard to stir?
  Was it for this the clay grew tall?
  --O what made fatuous sunbeams toil
  To break earth's sleep at all?"
17,Greater Love,"Red lips are not so red
As the stained stones kissed by the English dead.
Kindness of wooed and wooer
Seems shame to their love pure.
O Love, your eyes lose lure
When I behold eyes blinded in my stead!

Your slender attitude
Trembles not exquisite like limbs knife-skewed,
Rolling and rolling there
Where God seems not to care;
Till the fierce love they bear
Cramps them in death's extreme decrepitude.

Your voice sings not so soft,-
Though even as wind murmuring through raftered loft,-
Your dear voice is not dear,
Gentle, and evening clear,
As theirs whom none now hear,
Now earth has stopped their piteous mouths that coughed.

Heart, you were never hot
Nor large, nor full like hearts made great with shot;
And though your hand be pale,
Paler are all which trail
Your cross through flame and hail:
Weep, you may weep, for you may touch them not."
18,Happiness,"Ever again to breathe pure happiness,
So happy that we gave away our toy?
We smiled at nothings, needing no caress?
Have we not laughed too often since with Joy?
Have we not stolen too strange and sorrowful wrongs
For her hands' pardoning? The sun may cleanse,
And time, and starlight. Life will sing great songs,
And gods will show us pleasures more than men's.

Yet heaven looks smaller than the old doll's-home,
No nestling place is left in bluebell bloom,
And the wide arms of trees have lost their scope.
The former happiness is unreturning:
Boys' griefs are not so grievous as our yearning,
Boys have no sadness sadder than our hope."
19,Has Your Soul Sipped?,"Has your soul sipped
Of the sweetness of all sweets?
Has it well supped
But yet hungers and sweats?

I have been witness
Of a strange sweetness,
All fancy surpassing
Past all supposing.

Passing the rays
Of the rubies of morning,
Or the soft rise
Of the moon; or the meaning
Known to the rose
Of her mystery and mourning.

Sweeter than nocturnes
Of the wild nightingale
Or than love's nectar
After life's gall.

Sweeter than odours
Of living leaves,
Sweeter than ardours
Of dying loves.

Sweeter than death
And dreams hereafter
To one in dearth
Or life and its laughter.

Or the proud wound
The victor wears
Or the last end
Of all wars.

Or the sweet murder
After long guard
Unto the martyr
Smiling at God;

To me was that smile,
Faint as a wan, worn myth,
Faint and exceeding small,
On a boy's murdered mouth.

Though from his throat
The life-tide leaps
There was no threat
On his lips.

But with the bitter blood
And the death-smell
All his life's sweetness bled
Into a smile."
20,Hospital Barge at Cerisy,"Budging the sluggard ripples of the Somme,
A barge round old Cérisy slowly slewed.
Softly her engines down the current screwed,
And chuckled softly with contented hum,
Till fairy tinklings struck their croonings dumb.
The waters rumpling at the stern subdued;
The lock-gate took her bulging amplitude;
Gently from out the gurgling lock she swum.

One reading by that calm bank shaded eyes
To watch her lessening westward quietly.
Then, as she neared the bend, her funnel screamed.
And that long lamentation made him wise
How unto Avalon, in agony,
Kings passed in the dark barge, which Merlin dreamed."
21,Insensibility,"I

Happy are men who yet before they are killed
Can let their veins run cold.
Whom no compassion fleers
Or makes their feet
Sore on the alleys cobbled with their brothers.
The front line withers,
But they are troops who fade, not flowers
For poets' tearful fooling:
Men, gaps for filling
Losses who might have fought
Longer; but no one bothers.


II

And some cease feeling
Even themselves or for themselves.
Dullness best solves
The tease and doubt of shelling,
And Chance's strange arithmetic
Comes simpler than the reckoning of their shilling.
They keep no check on Armies' decimation.


III

Happy are these who lose imagination:
They have enough to carry with ammunition.
Their spirit drags no pack.
Their old wounds save with cold can not more ache.
Having seen all things red,
Their eyes are rid
Of the hurt of the colour of blood for ever.
And terror's first constriction over,
Their hearts remain small drawn.
Their senses in some scorching cautery of battle
Now long since ironed,
Can laugh among the dying, unconcerned.


IV

Happy the soldier home, with not a notion
How somewhere, every dawn, some men attack,
And many sighs are drained.
Happy the lad whose mind was never trained:
His days are worth forgetting more than not.
He sings along the march
Which we march taciturn, because of dusk,
The long, forlorn, relentless trend
From larger day to huger night.


V

We wise, who with a thought besmirch
Blood over all our soul,
How should we see our task
But through his blunt and lashless eyes?
Alive, he is not vital overmuch;
Dying, not mortal overmuch;
Nor sad, nor proud,
Nor curious at all.
He cannot tell
Old men's placidity from his.


VI

But cursed are dullards whom no cannon stuns,
That they should be as stones.
Wretched are they, and mean
With paucity that never was simplicity.
By choice they made themselves immune
To pity and whatever mourns in man
Before the last sea and the hapless stars;
Whatever mourns when many leave these shores;
Whatever shares
The eternal reciprocity of tears."
22,Inspection,"'You! What d'you mean by this?' I rapped.
'You dare come on parade like this?'
'Please, sir, it's-' ''Old yer mouth,' the sergeant snapped.
'I takes 'is name, sir?'-'Please, and then dismiss.'

Some days 'confined to camp' he got,
For being 'dirty on parade'.
He told me, afterwards, the damnèd spot
Was blood, his own. 'Well, blood is dirt,' I said.

'Blood's dirt,' he laughed, looking away,
Far off to where his wound had bled
And almost merged for ever into clay.
'The world is washing out its stains,' he said.
'It doesn't like our cheeks so red:
Young blood's its great objection.
But when we're duly white-washed, being dead,
The race will bear Field-Marshal God's inspection.'"
23,Le Christianisme,"So the church Christ was hit and buried
Under its rubbish and its rubble.
In cellars, packed-up saints long serried,
Well out of hearing of our trouble.

One Virgin still immaculate
Smiles on for war to flatter her.
She's halo'd with an old tin hat,
But a piece of hell will batter her."
